,ASIN,name,freq_bought,freq_bought_link
0,B087T9B6X5,"Canon EOS Rebel T100 DSLR Camera with 18-55mm f/3.5-5.6 Zoom Lens + 32GB Card, Tripod, Case, and More (18pc Bundle)","SanDisk 128GB Ultra SDXC UHS-I Memory Card - 100MB/s, C10, U1, Full HD, SD Card - SDSDUNR-128G-GN6IN",https://www.amazon.com/SanDisk-128GB-Ultra-UHS-I-Memory/dp/B07YFGG1SD/ref=pd_bxgy_2/140-4723308-6872266?_encoding=UTF8&pd_rd_i=B07YFGG1SD&pd_rd_r=69a8f1bc-e67e-49d7-8ab4-3409df467906&pd_rd_w=PovWs&pd_rd_wg=BCDzi&pf_rd_p=f325d01c-4658-4593-be83-3e12ca663f0e&pf_rd_r=32RKFJQFP5G38J54EGFK&psc=1&refRID=32RKFJQFP5G38J54EGFK
1,B0868VLMWK,"Canon EOS 4000D DSLR Camera with EF-S 18-55mm f/3.5-5.6 III Lens Advanced Bundle - Includes: Extended Life LPE10 Replacement Battery, 50"" Gripster Tripod & More","SanDisk 128GB Ultra SDXC UHS-I Memory Card - 100MB/s, C10, U1, Full HD, SD Card - SDSDUNR-128G-GN6IN",https://www.amazon.com/SanDisk-128GB-Ultra-UHS-I-Memory/dp/B07YFGG1SD/ref=pd_bxgy_2/144-6093014-9900966?_encoding=UTF8&pd_rd_i=B07YFGG1SD&pd_rd_r=f1c14b36-a8cc-4a9b-8be8-b356680d1fa3&pd_rd_w=qu7gm&pd_rd_wg=fQyk4&pf_rd_p=f325d01c-4658-4593-be83-3e12ca663f0e&pf_rd_r=XQQWQK2MK79VQFHGT6Z1&psc=1&refRID=XQQWQK2MK79VQFHGT6Z1
2,B08DQ4QQ6R,Canon EOS 4000D / Rebel T100 Digital SLR Camera Body w/Canon EF-S 18-55mm f/3.5-5.6 Lens 3 Lens DSLR Kit Bundled with Complete Accessory Bundle + 64GB + Flash + Case & More - International Model,,
3,B011PKJI2Y,"Panasonic LUMIX FZ300 Long Zoom Digital Camera Features 12.1 Megapixel, 1/2.3-Inch Sensor, 4K Video, WiFi, Splash & Dustproof Camera Body, LEICA DC 24X F2.8 Zoom Lens - DMC-FZ300K - (Black) USA",MegaGear Ultra Light Neoprene Camera Case Compatible with Panasonic Lumix DMC-FZ300,/MegaGear-Neoprene-Carabiner-Panasonic-DMC-FZ300/dp/B016MXJAC2/ref=pd_bxgy_2/130-8794770-6406629?_encoding=UTF8&pd_rd_i=B016MXJAC2&pd_rd_r=e5758a7d-0806-40ad-8cc0-68ac84532c0f&pd_rd_w=BltCI&pd_rd_wg=d4Tpl&pf_rd_p=f325d01c-4658-4593-be83-3e12ca663f0e&pf_rd_r=33NW1V3FF0NZYDNJD2M3&psc=1&refRID=33NW1V3FF0NZYDNJD2M3
4,B06XNTPN8C,"Canon EOS Rebel T6 Digital SLR Camera Kit with EF-S 18-55mm f/3.5-5.6 is II Lens, Built-in WiFi and NFC - Black (Renewed)","SanDisk 128GB Ultra SDXC UHS-I Memory Card - 100MB/s, C10, U1, Full HD, SD Card - SDSDUNR-128G-GN6IN",https://www.amazon.com/SanDisk-128GB-Ultra-UHS-I-Memory/dp/B07YFGG1SD/ref=pd_bxgy_2/136-0545009-0380566?_encoding=UTF8&pd_rd_i=B07YFGG1SD&pd_rd_r=fde9cdf4-d197-4c3d-85c2-dcd57181e30e&pd_rd_w=bfeXF&pd_rd_wg=rD78n&pf_rd_p=f325d01c-4658-4593-be83-3e12ca663f0e&pf_rd_r=PPGG6ER18FNXR2TX5A9M&psc=1&refRID=PPGG6ER18FNXR2TX5A9M
5,B019UDI5PO,Canon PowerShot SX420 Digital Camera w/ 42x Optical Zoom - Wi-Fi & NFC Enabled (Black),SanDisk Ultra 32GB Class 10 SDHC UHS-I Memory Card up to 80MB/s (SDSDUNC-032G-GN6IN),/SanDisk-Ultra-Class-Memory-SDSDUNC-032G-GN6IN/dp/B0143RT8OY/ref=pd_bxgy_2/139-1279268-1860409?_encoding=UTF8&pd_rd_i=B0143RT8OY&pd_rd_r=f65287ef-d69e-4eaa-abee-0d247ff48413&pd_rd_w=V9U7E&pd_rd_wg=etIjp&pf_rd_p=f325d01c-4658-4593-be83-3e12ca663f0e&pf_rd_r=GV41XHC6TSZSP7349PA0&psc=1&refRID=GV41XHC6TSZSP7349PA0
6,B088M5MRMS,"FeiyuTech AK2000C Gimbal 3-Axis Handheld Stabilizer for Mirrorless/DSLR Cameras Like Sony a9/a7/A6300/A6400,CANON EOS R,M50,80D,Panasonic GH4,GH5,Nikon Z7,FUJIFILM XT4/XT3,4.85 lb Payload,Quick Charge",,
7,B07Y5K1215,EOS 4000D Digital Camera with EF-S 18-55MM F/3.5-5.6 III Lens + Basic Accessories Bundle (International Version),"SanDisk 128GB Ultra SDXC UHS-I Memory Card - 100MB/s, C10, U1, Full HD, SD Card - SDSDUNR-128G-GN6IN",https://www.amazon.com/SanDisk-128GB-Ultra-UHS-I-Memory/dp/B07YFGG1SD/ref=pd_bxgy_2/136-0851986-6171243?_encoding=UTF8&pd_rd_i=B07YFGG1SD&pd_rd_r=0b3ac08f-55fb-469c-a0de-01ed232bb7a1&pd_rd_w=rvkdT&pd_rd_wg=kWS7N&pf_rd_p=f325d01c-4658-4593-be83-3e12ca663f0e&pf_rd_r=XF1AWRGSKKNEQY9KNRSX&psc=1&refRID=XF1AWRGSKKNEQY9KNRSX
8,B08S5FD42N,Canon EOS 2000D / Rebel T7 Digital SLR Camera Body w/Canon EF-S 18-55mm f/3.5-5.6 Lens 3 Lens DSLR Kit Bundled with Complete Accessory Bundle + 64GB + Flash + Case & More - International Model,,
9,B08N7ZRW9C,"Nikon D5600 DSLR Camera with 18-55mm VR Lens + 128GB Card, Tripod, Flash, ALS Variety Lens Cloth, and More",,
10,B07J5C98NW,FEELWORLD FW568 5.5 inch DSLR Camera Field Monitor Video Peaking Focus Assist Small Full HD 1920x1080 IPS with 4K HDMI 8.4V DC Input Output Include Tilt Arm,Feelworld DC 12V 1.5A Switching Power Supply Home Power Adapter for 100V - 240V AC 50/60Hz for…,https://www.amazon.com/Feelworld-Switching-Power-Supply-Adapter/dp/B07BKQTGDH/ref=pd_bxgy_2/141-9632170-4169553?_encoding=UTF8&pd_rd_i=B07BKQTGDH&pd_rd_r=c9360eb7-56b7-49a9-9ef7-f7bff9740ac3&pd_rd_w=WezRt&pd_rd_wg=3gmkf&pf_rd_p=f325d01c-4658-4593-be83-3e12ca663f0e&pf_rd_r=9Z39P79WZJJZED2FTP7Z&psc=1&refRID=9Z39P79WZJJZED2FTP7Z
11,B00NO1T55I,Sony Alpha a6000 Mirrorless Digital Camera w/ 16-50mm and 55-210mm Power Zoom Lenses,,
12,B01CQJHJ2E,"Canon Digital SLR Camera Kit [EOS Rebel T6] with EF-S 18-55mm and EF 75-300mm Zoom Lenses - Black, full-size",,
13,B08KYJR4BX,"Canon EOS 3000D (Rebel T100) DSLR Camera with 18-55mm f/3.5-5.6 Zoom Lens + 32GB Card, Tripod, Case, and More (18pc Bundle)",,
14,B00M8C7T70,"Kodak PIXPRO Astro Zoom AZ421-RD 16MP Digital Camera with 42X Optical Zoom and 3"" LCD Screen (Red)",SanDisk Ultra 32GB Class 10 SDHC UHS-I Memory Card up to 80MB/s (SDSDUNC-032G-GN6IN),/SanDisk-Ultra-Class-Memory-SDSDUNC-032G-GN6IN/dp/B0143RT8OY/ref=pd_bxgy_2/144-5254120-4853629?_encoding=UTF8&pd_rd_i=B0143RT8OY&pd_rd_r=cb6451ec-2cd6-436d-88be-f96ff7c036e3&pd_rd_w=lVGCV&pd_rd_wg=o1E7f&pf_rd_p=f325d01c-4658-4593-be83-3e12ca663f0e&pf_rd_r=YHCB2H0HP8CHWYX081D6&psc=1&refRID=YHCB2H0HP8CHWYX081D6
15,B08T2486DW,Canon EOS 80D Digital SLR Camera Body with Canon EF-S 18-55mm f/3.5-5.6 is STM Lens 3 Lens DSLR Kit Bundled with Complete Accessory Bundle + 64GB + Flash + Case/Bag & More - International Model,,
17,B07RCN2BFM,Lexar Professional 1667X 128GB (2-Pack) SDXC UHS-II Card (LSD128CBNA16672),"NP-FZ100 RAVPower Camera Battery Charger Set, 2-Pack 2040mAh Replacement Battery Kit, USB Dual Slot…",/NP-FZ100-RAVPower-Upgraded-Replacement-Compatible/dp/B07K84FMXK/ref=pd_bxgy_2/141-8460640-8755718?_encoding=UTF8&pd_rd_i=B07K84FMXK&pd_rd_r=f2b5b602-f266-4a06-b6e9-60a31064d865&pd_rd_w=O5znd&pd_rd_wg=1sgX2&pf_rd_p=f325d01c-4658-4593-be83-3e12ca663f0e&pf_rd_r=BMXM7TBZ0GBMP99SX2NW&psc=1&refRID=BMXM7TBZ0GBMP99SX2NW
18,B088P1824H,"Comica BoomX-D2 2.4GHZ Dual Wireless Lavalier Microphone, Wireless Lapel Mic with 2 Transmitter, 1 Receiver for Canon Nikon Sony DSLR Cameras, Camcorders, Lav Mic for iPhone Android Smartphone etc.",,
19,B07WHV3HXL,"Canon DSLR Camera [EOS 90D] with 18-135 is USM Lens | Built-in Wi-Fi, Bluetooth, DIGIC 8 Image Processor, 4K Video, Dual Pixel CMOS AF, and 3.0 Inch Vari-Angle Touch LCD Screen, Black","SanDisk 64GB Extreme PRO SDXC UHS-I Card - C10, U3, V30, 4K UHD, SD Card - SDSDXXY-064G-GN4IN",https://www.amazon.com/SanDisk-64GB-Extreme-UHS-I-SDSDXXY-064G-GN4IN/dp/B07H9J1YXN/ref=pd_bxgy_2/145-5182886-8658201?_encoding=UTF8&pd_rd_i=B07H9J1YXN&pd_rd_r=2d00a60f-b99b-4543-80f2-62d8e43dc4b8&pd_rd_w=oebP2&pd_rd_wg=dyXRm&pf_rd_p=f325d01c-4658-4593-be83-3e12ca663f0e&pf_rd_r=0ZPSY53RS6MM33QPJ1KN&psc=1&refRID=0ZPSY53RS6MM33QPJ1KN
20,B087TKG91L,"Canon EOS 4000D DSLR Camera with 18-55mm f/3.5-5.6 Zoom Lens + 32GB Card, Tripod, Case, and More (18pc Bundle)",,
21,B08JRVL5TH,"Nikon D3500 DSLR Camera with 18-55mm VR and 70-300mm Lenses + 128GB Card, Tripod, Flash, ALS VARIETY 21pc Bundle",,
22,B08KYGM5K5,Fujifilm X-S10 Mirrorless Digital Camera XF18-55mm Lens Kit - Black,"SanDisk 128GB Extreme PRO SDXC UHS-I Card - C10, U3, V30, 4K UHD, SD Card - SDSDXXY-128G-GN4IN",/SanDisk-128GB-Extreme-UHS-I-SDSDXXY-128G-GN4IN/dp/B07H9DVLBB/ref=pd_bxgy_2/139-4028094-3192935?_encoding=UTF8&pd_rd_i=B07H9DVLBB&pd_rd_r=72b66202-411d-4667-b5b1-3aa003f22904&pd_rd_w=s7fkX&pd_rd_wg=DLVvk&pf_rd_p=f325d01c-4658-4593-be83-3e12ca663f0e&pf_rd_r=6PRFHJR2BD47APEVQBXM&psc=1&refRID=6PRFHJR2BD47APEVQBXM
23,B08CRPZNK1,"MOSISO Camera Backpack,DSLR/SLR/Mirrorless Photography Camera Bag 15-16 Inch Waterproof Hardshell Case with Tripod Holder&Laptop Compartment Compatible with Canon/Nikon/Sony/DJI Mavic Drone,Navy Blue","SanDisk 128GB Extreme PRO SDXC UHS-I Card - C10, U3, V30, 4K UHD, SD Card - SDSDXXY-128G-GN4IN",https://www.amazon.com/SanDisk-128GB-Extreme-UHS-I-SDSDXXY-128G-GN4IN/dp/B07H9DVLBB/ref=pd_bxgy_2/146-9515631-9392537?_encoding=UTF8&pd_rd_i=B07H9DVLBB&pd_rd_r=d4709396-e6a7-4197-954c-67747d30bf25&pd_rd_w=2G3k3&pd_rd_wg=RI036&pf_rd_p=f325d01c-4658-4593-be83-3e12ca663f0e&pf_rd_r=XDM5VX0HWAPK2EYTHNC4&psc=1&refRID=XDM5VX0HWAPK2EYTHNC4
24,B07D519QXH,"DJI Ronin-S - Camera Stabilizer 3-Axis Gimbal Handheld for DSLR Mirrorless Cameras up to 8lbs / 3.6kg Payload for Sony Nikon Canon Panasonic Lumix, Black","SanDisk 128GB Extreme PRO SDXC UHS-I Card - C10, U3, V30, 4K UHD, SD Card - SDSDXXY-128G-GN4IN",/SanDisk-128GB-Extreme-UHS-I-SDSDXXY-128G-GN4IN/dp/B07H9DVLBB/ref=pd_bxgy_2/130-8200269-2489069?_encoding=UTF8&pd_rd_i=B07H9DVLBB&pd_rd_r=4cd5e189-b7af-47c6-9490-e3fc078b1ab8&pd_rd_w=KuOUc&pd_rd_wg=AZMcM&pf_rd_p=f325d01c-4658-4593-be83-3e12ca663f0e&pf_rd_r=54VQ340J431NVPW606TS&psc=1&refRID=54VQ340J431NVPW606TS
25,B0060MVJ1Q,Nikon D750 FX-format Digital SLR Camera Body,,
26,B01KITZRBE,Nikon D3400 DSLR Camera with AF-P DX NIKKOR 18-55mm f/3.5-5.6G VR and AF-P DX NIKKOR 70-300mm f/4.5-6.3G ED,SanDisk Ultra 64GB Class 10 SDXC UHS-I Memory Card up to 80MB/s (SDSDUNC-064G-GN6IN),https://www.amazon.com/SanDisk-Ultra-UHS-I-Memory-SDSDUNC-064G-GN6IN/dp/B0143IIP4W/ref=pd_bxgy_2/145-8144299-9277630?_encoding=UTF8&pd_rd_i=B0143IIP4W&pd_rd_r=214f36e4-e78a-4aac-8f4a-6489aa6a0f32&pd_rd_w=MjfJH&pd_rd_wg=TvWlg&pf_rd_p=f325d01c-4658-4593-be83-3e12ca663f0e&pf_rd_r=EHGFFTDPRHHYK161JSMK&psc=1&refRID=EHGFFTDPRHHYK161JSMK
27,B0013A1XDY,Nikon AF-S FX Micro-NIKKOR 2177 60mm f/2.8G ED Standard Macro Lens for Nikon DSLR Cameras,,
28,B088GNV9VV,Canon EOS T100/4000D DSLR Camera w/Canon EF-S 18-55mm F/3.5-5.6 III Zoom Lens + Case + 32GB SD Card + More + ZeeTech Cloth (Starter 32GB),,
29,B07CTFZSXZ,"11"" Adjustable Heavy Duty Robust Magic Arm, DSLR Mirrorless Action Camera Camcorder Smartphone LCD Monitor Video Light Vlog Rig w/ Desk Pole Clamp Holder Mounts Kit fit for GoPro iPhone (10 lbs Load)",,
30,B07G629BVJ,"Zoom SMC-1 Stereo Mini Cable for DSLR Camera, 3.5mm TRS to TRS Cable, Connect Zoom Audio Recorder to DLSR Camera","Zoom SMF-1 Shockmount for F1 Field Recorder, Hot Shoe Mount with Shockmount, Eliminates Rumble",/Zoom-SMF-1-Shock-Mount-Recorder/dp/B07G5XCP1C/ref=pd_bxgy_2/136-3894303-8507844?_encoding=UTF8&pd_rd_i=B07G5XCP1C&pd_rd_r=744d1b80-e91e-416b-ad19-fa80a3f66a26&pd_rd_w=T4N5X&pd_rd_wg=BQbtr&pf_rd_p=f325d01c-4658-4593-be83-3e12ca663f0e&pf_rd_r=7KJ6B7G7VM0CP7SK6PKB&psc=1&refRID=7KJ6B7G7VM0CP7SK6PKB
31,B074JBZKNL,"Arkscan MCM5 Tabletop Photography Videography Live Stream Zoom Meeting Classroom Table clamp Mount with ¼-20 mounting Bolt for iPhone Android Smartphone, and Nikon Sony Canon Camera & Camcorder",,
32,B08KSTH7WN,"Dazzne Desk Mount Stand, 12.9-22inch Tabletop C Clamp Mount Stand, Adjustable Table Aluminum Light Stand with Standard 1/4 Screw Tip for DSLR Camera, Ring Light, Video Light, Panel Light",,
33,B07FSJXHY9,"ESDDI Camera Tripod, DSLR Tripod with 360 Degree Ball Head, 64 inch Aluminum Tripod with Monopod 1/4 inch Quick Release Plate and Phone Holder for Vlog Travel and Work",,
37,B01GHVITB2,Pentax K-70 Weather-Sealed DSLR Camera with 18-135mm Lens (Silver),,
38,B084BKKX8T,"Canon EOS Rebel T8i EF-S 18-55mm is STM Lens Kit, Black",,
39,B08J74TNXW,"DJI RSC 2 – 3-Axis Gimbal Stabilizer for DSLR and Mirrorless Camera, Nikon Sony Panasonic Canon Fujifilm, 3kg Payload, Vertical Shooting, OLED Screen, Black","SanDisk 128GB Extreme PRO SDXC UHS-I Card - C10, U3, V30, 4K UHD, SD Card - SDSDXXY-128G-GN4IN",/SanDisk-128GB-Extreme-UHS-I-SDSDXXY-128G-GN4IN/dp/B07H9DVLBB/ref=pd_bxgy_2/135-0521768-0512263?_encoding=UTF8&pd_rd_i=B07H9DVLBB&pd_rd_r=bdaff633-8690-484d-99cf-a09b927834ff&pd_rd_w=munJJ&pd_rd_wg=i7RcY&pf_rd_p=f325d01c-4658-4593-be83-3e12ca663f0e&pf_rd_r=FE74VY7HC412JZXRZNQY&psc=1&refRID=FE74VY7HC412JZXRZNQY
40,B08PXTMD39,TARION Camera Strap Adjustable DSLR Camera Neck Strap Belt Retro Film Camera Shoulder Strap Vintage Soft Long Rope Universal Cord for Women Men SLR Mirrorless Cameras(Upgraded Version) (Denim Blue),,
41,B08R5DX55H,"BAGSMART Camera Backpack, DSLR SLR Canvas Camera Bag Fits 13.3 Inch Laptop Water Resistant with Rain Cover Tripod Holder,for Men Women,Canvas Brown",,
42,B08CZC7CB9,FEELWORLD F5 Pro 5.5 Inch Touch Screen DSLR Camera Field Monitor with External Kit Install The Equipment IPS FHD1920x1080 4K HDMI Input Output 5 V Type-c Input Lightweight DesignTilt Arm Sun Shade,,
44,B00A86MMY8,Delkin Devices Fat Gecko Triple Suction Camera Mount (DDMNT-TRIPLE),,
45,B085Y3D3B1,"CADeN Camera Backpack Bag Professional for DSLR/SLR Mirrorless Camera Waterproof, Camera Case Compatible for Sony Canon Nikon Camera and Lens Tripod Accessories Blue","SanDisk 128GB Extreme PRO SDXC UHS-I Card - C10, U3, V30, 4K UHD, SD Card - SDSDXXY-128G-GN4IN",https://www.amazon.com/SanDisk-128GB-Extreme-UHS-I-SDSDXXY-128G-GN4IN/dp/B07H9DVLBB/ref=pd_bxgy_2/144-9710981-1344320?_encoding=UTF8&pd_rd_i=B07H9DVLBB&pd_rd_r=810fc64e-f7bc-46c1-8d97-506d6e8c4754&pd_rd_w=gqdrk&pd_rd_wg=QmqEW&pf_rd_p=f325d01c-4658-4593-be83-3e12ca663f0e&pf_rd_r=ZJKF4QQTCEX1P0SCE5B1&psc=1&refRID=ZJKF4QQTCEX1P0SCE5B1
46,B07J5F8WGG,Canon PowerShot SX420 Digital Camera w/42x Optical Zoom - Wi-Fi & NFC Enabled (Black) + 64GB SD Memory Card,SanDisk Ultra 32GB Class 10 SDHC UHS-I Memory Card up to 80MB/s (SDSDUNC-032G-GN6IN),https://www.amazon.com/SanDisk-Ultra-Class-Memory-SDSDUNC-032G-GN6IN/dp/B0143RT8OY/ref=pd_bxgy_2/134-6126826-7736526?_encoding=UTF8&pd_rd_i=B0143RT8OY&pd_rd_r=84a83440-18bc-4d1c-ab78-7fcbce96d406&pd_rd_w=0Sw2z&pd_rd_wg=9gkPB&pf_rd_p=f325d01c-4658-4593-be83-3e12ca663f0e&pf_rd_r=TBTZADDQC131VJHQVP5C&psc=1&refRID=TBTZADDQC131VJHQVP5C
47,B01KURGS9Y,Canon EOS 5D Mark IV Full Frame Digital SLR Camera with EF 24-105mm f/4L IS II USM Lens Kit,Canon Battery Grip BG-E20 for the Canon 5D Mark IV Digital SLR Camera,https://www.amazon.com/Canon-Battery-BG-E20-Digital-Camera/dp/B01KURGUKG/ref=pd_bxgy_2/136-2416574-8622702?_encoding=UTF8&pd_rd_i=B01KURGUKG&pd_rd_r=c6a0f516-5528-48ac-abf8-c360ddbb86fc&pd_rd_w=sxHPc&pd_rd_wg=FhVJh&pf_rd_p=f325d01c-4658-4593-be83-3e12ca663f0e&pf_rd_r=KXCSE9YP7EKNANP7H417&psc=1&refRID=KXCSE9YP7EKNANP7H417
48,B087V2QQSN,"Nikon D5600 DSLR Camera with 18-55mm VR Lens + 32GB Card, Tripod, Case, and More (18pc Bundle)","Camera Screen Protector Compatible Nikon D5600 D5500 D5300, AFUNTA 2 Pack Anti-Scratch Tempered…",https://www.amazon.com/Protector-Compatible-AFUNTA-Anti-Scratch-Tempered/dp/B01IP0Q34S/ref=pd_bxgy_2/135-9347584-6878727?_encoding=UTF8&pd_rd_i=B01IP0Q34S&pd_rd_r=7bcf6026-5e75-4e2c-aedb-0625e9fdbe92&pd_rd_w=srgGg&pd_rd_wg=qGTUY&pf_rd_p=f325d01c-4658-4593-be83-3e12ca663f0e&pf_rd_r=Y47V6VD7Y4W5WRW4Q2W7&psc=1&refRID=Y47V6VD7Y4W5WRW4Q2W7
49,B0751MNKLB,"Olympus OM-D E-M10 Mark III Camera Body (Black), Wi-Fi Enabled, 4K Video",,
50,B08DR2KQCX,"Lusweimi Video Tripod System, 75-inch Aluminum Heavy Duty Tripod with Fluid Head, Professional Cameras Tripod for Canon Nikon DSLR Sony Camcorders 1/4 and 3/8 Screws Quick Plate",,
51,B081DB9GLD,"Movo WMX-1 2.4GHz Wireless Lavalier Microphone System Compatible with DSLR Cameras, Camcorders, iPhone, Android Smartphones, and Tablets (200' ft Audio Range)",,
54,B019W91U7G,"Neewer DSLR Movie Video Making Rig Set System Kit for Camcorder or DSLR Camera Such as Canon Nikon Sony Pentax Fujifilm Panasonic,Include:(1) Shoulder Mount+(1) 15mm Rail Rod System+(1) Matte Box",TAKSTAR SGC-598 Interview Microphone for Nikon/Canon Camera/DV Camcorder,https://www.amazon.com/TAKSTAR-SGC-598-Interview-Microphone-Camcorder/dp/B00E58AA0I/ref=pd_bxgy_2/145-7918451-9660919?_encoding=UTF8&pd_rd_i=B00E58AA0I&pd_rd_r=477f57d4-8ee5-4bea-ba08-c96594eacb26&pd_rd_w=yWFFB&pd_rd_wg=C4rqO&pf_rd_p=f325d01c-4658-4593-be83-3e12ca663f0e&pf_rd_r=35VEMV4AGK2YW8AQ3977&psc=1&refRID=35VEMV4AGK2YW8AQ3977
55,B00XI87KV8,Amazon Basics Lightweight Camera Mount Tripod Stand With Bag - 16.5 - 50 Inches,,
56,B01LWYSKYR,FEELWORLD FW759 7 Inch DSLR Camera Field Monitor HD Video Assist Slim IPS 1280x800 4K HDMI 1080p with Sunshade,,
57,B00IB1BTWI,Canon EOS Rebel T5 Digital SLR Camera Kit with EF-S 18-55mm IS II Lens,,
58,B071K61XFC,Canon EOS Rebel SL2 Digital SLR Camera Body - WiFi Enabled,,
59,B088X46WS4,EOS 90D Digital SLR Camera Body with EF-S 18-55mm f/3.5-5.6 is STM Lens - 64GB Expo Basic Bundle,,
60,B07ZCWMRZT,"TOAZOE 11"" Adjustable Robust Articulating Friction Magic Arm Clamp Holder Mounts Kit for DSLR/Mirrorless/Action Camera/Camcorder/LCD Monitor Video Vlog Rig w/Smartphone/iPhone/GoPro/Arlo etc",,
62,B0894RVPH2,"Camera Bag, BAGSMART SLR DSLR Canvas Camera Case, Vintage Padded Shoulder Bag with Rain Cover for Women, Men, Black","SanDisk 128GB Extreme PRO SDXC UHS-I Card - C10, U3, V30, 4K UHD, SD Card - SDSDXXY-128G-GN4IN",https://www.amazon.com/SanDisk-128GB-Extreme-UHS-I-SDSDXXY-128G-GN4IN/dp/B07H9DVLBB/ref=pd_bxgy_2/147-9969989-9534603?_encoding=UTF8&pd_rd_i=B07H9DVLBB&pd_rd_r=936184ae-6106-4013-946e-c284d37c5af2&pd_rd_w=MmB5V&pd_rd_wg=oLIgD&pf_rd_p=f325d01c-4658-4593-be83-3e12ca663f0e&pf_rd_r=00HRKY5D0FSSXFZ1QPKW&psc=1&refRID=00HRKY5D0FSSXFZ1QPKW
63,B07WDVWL72,"BAGSMART Camera Backpack, Anti-Theft DSLR SLR Camera Bag Water Resistant Canvas Backpack Fit up to 15"" Laptop with Rain Cover, Tripod Holder for Women and Men (Black)","SanDisk 128GB Extreme SDXC UHS-I Card - C10, U3, V30, 4K UHD, SD Card - SDSDXV5-128G-GNCIN",https://www.amazon.com/SanDisk-128GB-Extreme-UHS-I-SDSDXV5-128G-GNCIN/dp/B07H48412Q/ref=pd_bxgy_2/141-4660243-1380210?_encoding=UTF8&pd_rd_i=B07H48412Q&pd_rd_r=4eedcbc5-d24f-4ea9-be8e-6720f121a503&pd_rd_w=tAje8&pd_rd_wg=mRtSE&pf_rd_p=f325d01c-4658-4593-be83-3e12ca663f0e&pf_rd_r=YWRBFRPC5JZ0RE5RB8MC&psc=1&refRID=YWRBFRPC5JZ0RE5RB8MC
64,B08SZJK62V,Canon EOS 90D Digital SLR Camera Body with Canon EF-S 18-55mm f/3.5-5.6 is STM Lens 3 Lens DSLR Kit Bundled with Complete Accessory Bundle + 64GB + Flash + Case/Bag & More - International Model,,
65,B07517VVGD,Endurax Extra Large Camera DSLR/SLR Backpack for Outdoor Hiking Trekking with 15.6 Laptop Compartment,"SanDisk 128GB Extreme PRO SDXC UHS-I Card - C10, U3, V30, 4K UHD, SD Card - SDSDXXY-128G-GN4IN",https://www.amazon.com/SanDisk-128GB-Extreme-UHS-I-SDSDXXY-128G-GN4IN/dp/B07H9DVLBB/ref=pd_bxgy_2/141-6939687-8625738?_encoding=UTF8&pd_rd_i=B07H9DVLBB&pd_rd_r=7c22d605-e392-4575-bae5-77fdf117be9f&pd_rd_w=aWtm2&pd_rd_wg=fxvuJ&pf_rd_p=f325d01c-4658-4593-be83-3e12ca663f0e&pf_rd_r=ZJ4B8B5XAHFBVJ14DQXX&psc=1&refRID=ZJ4B8B5XAHFBVJ14DQXX
66,B07L62WDH6,"Wireless Microphone Comica CVM-WM100 Plus 48-Channel Professional UHF Dual Wireless Lavalier Lapel Microphone System for Canon Nikon Sony Panasonic DSLR Cameras,XLR Camcorder,Smartphone etc.(2TX+1RX)",,
67,B08RX8J47V,"Camera Microphone, Video Microphone Works for Canon Nikon Sony Panasonic Fuji Camera,DSLR Interview Shotgun Mic with Windscreen 3.5mm Jack…",,
68,B07CKPMN18,FEELWORLD FW450 4.5 Inch DSLR On Camera Field Monitor 4K HDMI Input Output Small HD Focus 1280x800 Ultra Lightweight Video Assist,,
69,B0779PLTN1,NICERYIG 3/8 Inch and 1/4 Inch Camera Quick Release Screw Tripod Screw Adapter Connecter DSLR Camera Rig Accessories,,
71,B085L9V79L,FEELWORLD LUT7 7 Inch Ultra Bright 2200nit Touch Screen Camera DSLR Field Monitor with 3D Lut Waveform Vectorscope Automatic Light Sensor 1920x1200 Video Assist 4K HDMI Input 8.4V DC Output Tilt Arm,,
72,B081357PWR,"Hollyland Mars 400S [Official] Wireless SDI/HDMI Video Transmitter and Receiver for DSLR Camera, 400ft Long Range 0.1s Low Latency 1080P HD Video WiFi Transmission System",,
73,B08FDKLG76,"Neewer FW600 5.5-Inch Touch Screen Camera Field Monitor Full HD 1920x1080, 4K HDMI DC in/Output RGB Waveform/Vector Scope/3D-LUT，Video Peaking Focus Assist with Tilt Arm for DSLR Cameras and Gimbal",,
74,B088Z264C8,"Endurax 60'' Camera Phone Tripod Stand for DSLR Canon Nikon with Universal Phone Mount, Bubble Level and Carry Bag","SanDisk 128GB Extreme PRO SDXC UHS-I Card - C10, U3, V30, 4K UHD, SD Card - SDSDXXY-128G-GN4IN",https://www.amazon.com/SanDisk-128GB-Extreme-UHS-I-SDSDXXY-128G-GN4IN/dp/B07H9DVLBB/ref=pd_bxgy_2/145-3311685-2231467?_encoding=UTF8&pd_rd_i=B07H9DVLBB&pd_rd_r=5ed7e3ef-3c02-4623-b666-c4ad01f90275&pd_rd_w=jLkIo&pd_rd_wg=jcD02&pf_rd_p=f325d01c-4658-4593-be83-3e12ca663f0e&pf_rd_r=FT5BPQD7T6KX4D5KJV3N&psc=1&refRID=FT5BPQD7T6KX4D5KJV3N
75,B07F2LCBSP,"YoTilon Camera Tripod for DSLR, Portable Lightweight Travel Tripod for Camera, 360 Degree SLR Ball Tripods with 1/4 Plate for Canon Nikon Sony, Best Choice for Travel and Work.","SanDisk 128GB Extreme PRO SDXC UHS-I Card - C10, U3, V30, 4K UHD, SD Card - SDSDXXY-128G-GN4IN",https://www.amazon.com/SanDisk-128GB-Extreme-UHS-I-SDSDXXY-128G-GN4IN/dp/B07H9DVLBB/ref=pd_bxgy_2/137-7485733-5612151?_encoding=UTF8&pd_rd_i=B07H9DVLBB&pd_rd_r=b5065f0d-c122-47a9-891c-d5ed30d9413c&pd_rd_w=Pl8t1&pd_rd_wg=muzWA&pf_rd_p=f325d01c-4658-4593-be83-3e12ca663f0e&pf_rd_r=YDQQNNVCA716DSVHQENP&psc=1&refRID=YDQQNNVCA716DSVHQENP
77,B00DMS0GTC,Canon EOS 70D Digital SLR Camera (Body Only),"SanDisk 64GB Extreme PRO SDXC UHS-I Card - C10, U3, V30, 4K UHD, SD Card - SDSDXXY-064G-GN4IN",https://www.amazon.com/SanDisk-64GB-Extreme-UHS-I-SDSDXXY-064G-GN4IN/dp/B07H9J1YXN/ref=pd_bxgy_2/144-9399150-8601344?_encoding=UTF8&pd_rd_i=B07H9J1YXN&pd_rd_r=177b10cd-6975-4b52-8fe5-bf3130145095&pd_rd_w=yteB5&pd_rd_wg=UvaBJ&pf_rd_p=f325d01c-4658-4593-be83-3e12ca663f0e&pf_rd_r=653HKDW5T6FT8YKDVWWG&psc=1&refRID=653HKDW5T6FT8YKDVWWG
78,B077FTPT46,Neewer Film Movie Video Making System Kit with F100 7-inch 1280x800 IPS Screen Field Monitor (Support 4k Input) and Cool Ballhead Arm (Monitor),,
80,B089FWTFNX,"MOSHUSO Camera Mount Clamp with 360° Ballhead Arm, for DSLR Camera/Field Monitor/LED",,
81,B072YT9KXW,Tamron 18-400mm F/3.5-6.3 DI-II VC HLD All-In-One Zoom For Nikon APS-C Digital SLR Cameras (6 Year Limited USA Warranty),Hoya 72mm DMC PRO1 Digital Circular Polarizer Glass Filter,https://www.amazon.com/Hoya-Digital-Circular-Polarizer-Filter/dp/B000KZ5YJ2/ref=pd_bxgy_2/133-3809207-7659060?_encoding=UTF8&pd_rd_i=B000KZ5YJ2&pd_rd_r=83038784-74d1-40f8-aecd-c9f2783f05ec&pd_rd_w=qWdS5&pd_rd_wg=cu6hS&pf_rd_p=f325d01c-4658-4593-be83-3e12ca663f0e&pf_rd_r=8WMNFVNEN81S90PF4V83&psc=1&refRID=8WMNFVNEN81S90PF4V83
82,B07ZV4QX6C,"Torjim 60” Camera Tripod with Carry Bag, Lightweight Travel Aluminum Professional Tripod Stand (5kg/11lb Load) with Bluetooth Remote for DSLR SLR Cameras Compatible with Phone-Black","SanDisk 128GB Ultra SDXC UHS-I Memory Card - 100MB/s, C10, U1, Full HD, SD Card - SDSDUNR-128G-GN6IN",https://www.amazon.com/SanDisk-128GB-Ultra-UHS-I-Memory/dp/B07YFGG1SD/ref=pd_bxgy_2/131-1727171-8493060?_encoding=UTF8&pd_rd_i=B07YFGG1SD&pd_rd_r=6a3a7d09-bf5a-467a-8356-461cda6ec2bb&pd_rd_w=hIqyG&pd_rd_wg=DYJPA&pf_rd_p=f325d01c-4658-4593-be83-3e12ca663f0e&pf_rd_r=9SETMGYD08VQV0CWMFQ9&psc=1&refRID=9SETMGYD08VQV0CWMFQ9
83,B08SJFHZZ2,Saramonic Blink500 Pro 2.4GHz Dual-Channel Wireless Lavalier Microphone for DSLR Video Camera Android iOS iPhone Tablet PC Computer Recording Facebook YouTube Podcast Vlog Interview,,
84,B07YY988NQ,"2.4GHz Wireless Lavalier Microphone System, Saramonic Blink500 B2 Dual-Channel Mic Two Transmitters for DSLR Camera, Mirrorless, and Smartphone for YouTube Facebook Live Vlogging","Sony ZV-1 Camera for Content Creators, Vlogging and YouTube with Flip Screen and Microphone",https://www.amazon.com/Sony-Content-Creators-Vlogging-Microphone/dp/B08965JV8D/ref=pd_bxgy_2/139-6344662-6410112?_encoding=UTF8&pd_rd_i=B08965JV8D&pd_rd_r=cb0793ad-2133-4327-ab32-b511ae8fb08d&pd_rd_w=5bn0H&pd_rd_wg=qFSRZ&pf_rd_p=f325d01c-4658-4593-be83-3e12ca663f0e&pf_rd_r=C9W2DT2RH2CKN41PND4G&psc=1&refRID=C9W2DT2RH2CKN41PND4G
85,B07C6V3CQ8,Neewer Aluminum Film Movie Kit System Rig for Canon/Nikon/Pentax/Sony and other DSLR Cameras (Style II),,
86,B07PP78973,"Neewer Camera Slider Video Track Dolly Rail Stabilizer: 31-inch/80cm, Flywheel Counterweight with Light Carbon Fiber Rails, Adjustable Legs, Carry Bag, DSLR Camera Camcorder Track for Filming",,
87,B00QI6Y3X0,Neewer Aluminum Alloy Camera Video Cage Film Movie Making Kit include:(1)Video Cage(1)Top Handle Grip(2)15mm Rod for DSLR Cameras Such as Canon 5D mark II III 700D 650D Nikon D7200 Pentax Sony Olympus,"NEEWER 160 LED CN-160 Dimmable Ultra High Power Panel Digital Camera / Camcorder Video Light, LED…",https://www.amazon.com/Dimmable-Digital-Camcorder-Panasonic-Samsung/dp/B004TJ6JH6/ref=pd_bxgy_2/132-4721975-4299209?_encoding=UTF8&pd_rd_i=B004TJ6JH6&pd_rd_r=c3063de6-190f-4aba-9936-b238b2bd0e3b&pd_rd_w=iOKyy&pd_rd_wg=6L85I&pf_rd_p=f325d01c-4658-4593-be83-3e12ca663f0e&pf_rd_r=H33R0NVNJ1VTNB0JY6ZY&psc=1&refRID=H33R0NVNJ1VTNB0JY6ZY
90,B07SKBMG96,EOS 2000D (Rebel T7) Digital SLR Camera with 18-55mm is II Lens Kit (Black) - Advanced Accessories Bundle,,
91,B01MR2D0OG,Nikon D5600 DSLR with 18-55mm f/3.5-5.6G VR and 70-300mm f/4.5-6.3G ED,,
92,B08F1W97PV,Touch-Screen-On-Camera-Filed-Monitor 5.5 inch Moman M5 1920X1080 Full HD 500nits with 3D LUT/HDR/Waveform/Vector Scope for DSLR/Mirrorless Camera,,
93,B08SQFHJQY,FEELWORLD LUT7S PRO 7 Inch Ultra Bright 2200nits DSLR Camera Field Monitor 3D LUT Touch Screen HDR with Waveform F970 External Power and Install Kit 4K HDMI 3G-SDI Input Output 1920X1200 IPS Panel,,
