,ASIN,name,freq_bought,freq_bought_link
1007,B07Q8R9B98,"Camera Backpack, Waterproof Large DSLR Camera Bag with 15.6"" Laptop Compartments Rain Cover, Outdoor Travel Camera Backpack Case for Nikon Canon Sony Pentax DSLR/SLR Cameras, Tripod and Accessories","Pink Marble Personalized Round Mouse Pad for Laptop Women, Glitter Rose Gold Marble Pattern, Non…",https://www.amazon.com/Personalized-Non-Slip-Comfortable-Customized-Computer/dp/B0874J3PCJ/ref=pd_bxgy_2/136-4882640-5234065?_encoding=UTF8&pd_rd_i=B0874J3PCJ&pd_rd_r=dcf791c4-4e83-443d-a47b-7c0ee266018d&pd_rd_w=GLmxd&pd_rd_wg=701LS&pf_rd_p=f325d01c-4658-4593-be83-3e12ca663f0e&pf_rd_r=VAA2K12Z53ZCHWRE13D8&psc=1&refRID=VAA2K12Z53ZCHWRE13D8
1008,B07JHH9XZH,FEELWORLD FW279S 7 Inch 2200nit Daylight Viewable Full HD 1920x1200 IPS Panel DSLR On Camera Field Monitor 3G SDI 4K HDMI Input/Output Video Assist Peaking Focus,,
1009,B085HZLWGC,"Lusweimi 60-Inch Tripod for ipad iPhone, Camera Tripod for Phone with 2 in 1 Tripod Mount Holder for Cell Phone/Tablet/Webcam/Gopro/All Cameras, Tripod with Carry Bag for Travel/Photography/Video","Smoothie Blender,Youmeet Cup Blender Remaining Power Display,USB Rechargeable Blender Mini Blenders…",https://www.amazon.com/Smoothie-Youmeet-Remaining-Rechargeable-Smoothies/dp/B088PQJXCV/ref=pd_bxgy_2/141-1718709-9545845?_encoding=UTF8&pd_rd_i=B088PQJXCV&pd_rd_r=7dcdc5c9-3b83-492e-89c9-0a2e52b93fc4&pd_rd_w=nP56l&pd_rd_wg=QpPHs&pf_rd_p=f325d01c-4658-4593-be83-3e12ca663f0e&pf_rd_r=VKTHEB5EMH9XHTYBZT3X&psc=1&refRID=VKTHEB5EMH9XHTYBZT3X
1010,B07JCHFJS5,Cotton Carrier Skout Sling Style Harness for One Camera - Grey,Cotton Carrier Hand Strap - with Arca Swiss-Compatible Mini-Plate,https://www.amazon.com/Cotton-Carrier-Hand-Strap-Swiss-Compatible/dp/B00D12AHF2/ref=pd_bxgy_2/134-6463938-5469023?_encoding=UTF8&pd_rd_i=B00D12AHF2&pd_rd_r=6b5dde9f-afda-4367-bf55-1a95e5bcf9f9&pd_rd_w=RzMLH&pd_rd_wg=IuOey&pf_rd_p=f325d01c-4658-4593-be83-3e12ca663f0e&pf_rd_r=0QVBDDF0AM6PEXF12TQ6&psc=1&refRID=0QVBDDF0AM6PEXF12TQ6
1011,B07N9KDCGV,"Canon EOS RP Full Frame Mirrorless Vlogging Portable Digital Camera with 26.2MP Full-Frame CMOS Sensor, Wi-Fi , Bluetooth, 4K Video Recording and 3.0” Vari-angle Touch LCD Screen, Body, Black,",Lens Adapter EF-EOS R Auto-Focus Mount Converter Compatible with Canon EF/EF-S Lens to EOS RP R R5…,https://www.amazon.com/Adapter-EF-EOS-Auto-Focus-Converter-Compatible/dp/B084HF7KCY/ref=pd_bxgy_2/144-9307629-3282234?_encoding=UTF8&pd_rd_i=B084HF7KCY&pd_rd_r=b063f562-43ef-4389-aa45-9aca2bf6360c&pd_rd_w=iYbda&pd_rd_wg=92asb&pf_rd_p=f325d01c-4658-4593-be83-3e12ca663f0e&pf_rd_r=46DDRSA92JJHT7V36WKJ&psc=1&refRID=46DDRSA92JJHT7V36WKJ
1012,B079DS2C2N,Camera Lens Pouch JJC DSLR Camera Lens Bag Case for Canon 100-300mm 75-300mm 24-70mm 55-250mm 135mm Nikon 55-300mm 70-300mm Tamron 10-24mm for Lens with 3.15x6.69”,"JJC Deluxe Lens Case Pouch for Canon EF-S 18-55mm/EF-S 10-18mm/EF 50mm,Nikon AF-S 18-55mm/AF-P 18…",https://www.amazon.com/JJC-Deluxe-18-55mm-10-18mm-Fujinon/dp/B072ZZ5KCL/ref=pd_bxgy_2/135-2439679-6460819?_encoding=UTF8&pd_rd_i=B072ZZ5KCL&pd_rd_r=2df933a3-847a-45bf-8c46-891507c3ff56&pd_rd_w=38yuz&pd_rd_wg=xYvLX&pf_rd_p=f325d01c-4658-4593-be83-3e12ca663f0e&pf_rd_r=PMQVDAS7JKZ90FNBQ7RZ&psc=1&refRID=PMQVDAS7JKZ90FNBQ7RZ
1018,B08R96SJNY,Slik Pro CF-934 Lightweight Carbon Fiber Tripod Legs for DSLR Camera and Video - Extends up to 73.6 inches,,
1019,B07X1XKJTK,ANNSM HS60-C Professional Handheld 24”/60cm Carbon Fiber Video Stabilizer for DSLR Cameras/Camcorders/Home DV/Smartphones/iPhones Quick Shoe Plate with 1/4” and 3/8” Screw Height/Weight Adjustable in,,
1020,B07GMZRT7L,"UTEBIT 7 inch Articulating Friction Arm with Large Super Crab Clamp and Hot Shoe Mount 1/4"" Magic DSLR Tripod Arms Kit for Photography, Video, Camera Rig, LED Light, Flash Light, LCD Monitor",,
1022,B01N2HUS78,GREEN.L Infrared Filter 58mm IR 720nm X-Ray Filter Optical Glass Filter,,
1024,B00T3ER7QO,Canon EOS Rebel T6i Digital SLR with EF-S 18-55mm IS STM Lens - Wi-Fi Enabled,SanDisk Ultra 64GB Class 10 SDXC UHS-I Memory Card up to 80MB/s (SDSDUNC-064G-GN6IN),https://www.amazon.com/SanDisk-Ultra-UHS-I-Memory-SDSDUNC-064G-GN6IN/dp/B0143IIP4W/ref=pd_bxgy_2/147-0410395-1584313?_encoding=UTF8&pd_rd_i=B0143IIP4W&pd_rd_r=4d0d9077-0687-4dd4-a108-391c6ec0fccd&pd_rd_w=vBawH&pd_rd_wg=U7DBV&pf_rd_p=f325d01c-4658-4593-be83-3e12ca663f0e&pf_rd_r=KCH3CHWESJ98PV0Z1FN6&psc=1&refRID=KCH3CHWESJ98PV0Z1FN6
1025,B076TWSF5Y,Estarer Camera Shoulder Bag for SLR/DSLR Digital Cameras 14inch Laptop Canvas Messenger Bag with Camera Insert Sleeve,"SanDisk 128GB Extreme PRO SDXC UHS-I Card - C10, U3, V30, 4K UHD, SD Card - SDSDXXY-128G-GN4IN",https://www.amazon.com/SanDisk-128GB-Extreme-UHS-I-SDSDXXY-128G-GN4IN/dp/B07H9DVLBB/ref=pd_bxgy_2/133-1692902-1451560?_encoding=UTF8&pd_rd_i=B07H9DVLBB&pd_rd_r=8fe3e1ae-006c-4a64-a83f-becc3b25fb41&pd_rd_w=0Kc91&pd_rd_wg=L8N87&pf_rd_p=f325d01c-4658-4593-be83-3e12ca663f0e&pf_rd_r=0BBPCVNVXADZN53NZ3E0&psc=1&refRID=0BBPCVNVXADZN53NZ3E0
1026,B07M9GK8DR,DSLR Stabilizer Handheld Video Action Stabilizing Handle Grip C Shape Professional Vlogging for Smart Phones GoPro Canon Nikon Sony Panasonic Pentax Olympus Camera Camcorder (Pack of 1),"Moukey MCM-1 DSLR Camera Microphone, External Video Mic Shotgun for Phone, Smartphone, Vlogging…",https://www.amazon.com/Moukey-Microphone-External-Smartphone-Vlogging/dp/B07P7P6M2J/ref=pd_bxgy_2/144-7392124-4786814?_encoding=UTF8&pd_rd_i=B07P7P6M2J&pd_rd_r=4c1c8500-3893-47d3-aaae-13c382a0fd0f&pd_rd_w=XTjJK&pd_rd_wg=lBsTi&pf_rd_p=f325d01c-4658-4593-be83-3e12ca663f0e&pf_rd_r=637QGQ0310QZ6FWGPZZB&psc=1&refRID=637QGQ0310QZ6FWGPZZB
1027,B07G9RN3YZ,"Tamron AFA037C700 17-35mm f/2.8-4 DI OSD Lens for Canon Digital SLR Cameras, Black",,
1028,B0891WFN67,"VARIPOWDER Camera Shoulder Neck Strap, Cameras Climbing Rope Shoulder Strap for All DSLR Camera/Nikon/Canon/Sony/Fujifilm/Pentax",,
1029,B01LFQYFCG,"BlackRapid Camera Wrist Strap with FastenR FR-5 to Connect to Tripod Mount on DSLR, SLR and Mirrorless Cameras",BlackRapid Breathe FR-5 FastenR,https://www.amazon.com/BlackRapid-020728-Breathe-FR-5-FastenR/dp/B01LFSFQCM/ref=pd_bxgy_2/141-9480050-7497050?_encoding=UTF8&pd_rd_i=B01LFSFQCM&pd_rd_r=c73ec865-be2f-468d-b6b1-9935becaa9f6&pd_rd_w=JjqIb&pd_rd_wg=FXQNM&pf_rd_p=f325d01c-4658-4593-be83-3e12ca663f0e&pf_rd_r=Y7QZK7BEFVHM6N2D9CHW&psc=1&refRID=Y7QZK7BEFVHM6N2D9CHW
1030,B06XWVCTK4,"Neewer 3 Pieces 1/4 inch Screw Tripod Mini Ball Head with Lock and Hot Shoe Adapter for LED Light,Monitor,DSLR Cameras,Video and Camcorders",Neewer Black Metal Cold Shoe Flash Stand Adapter with 1/4-inch -20 Tripod Screw (5 Packs),https://www.amazon.com/Neewer-Black-Adapter-4-inch-Tripod/dp/B00M1MF7PI/ref=pd_bxgy_2/145-7536609-9282612?_encoding=UTF8&pd_rd_i=B00M1MF7PI&pd_rd_r=9575dc77-5ae7-4ce0-a2da-f6bd90aa0fce&pd_rd_w=dPkHX&pd_rd_wg=db7tC&pf_rd_p=f325d01c-4658-4593-be83-3e12ca663f0e&pf_rd_r=GKZKEYMPJ9AR18CFR59T&psc=1&refRID=GKZKEYMPJ9AR18CFR59T
1031,B07GXNNS4H,Saramonic SR-PAX2 Camera Microphone Audio Mixer Adapter Preamplifier Two XLR and Two 3.5mm Jack Compatible with DSLR & Mirrorless & Blackmagic Design Pocket Cinema Cameras,,
1032,B01LFREKUM,"BlackRapid Double Breathe Camera Harness, Trusted Strap Design for One or Two DSLR, SLR and Mirrorless Cameras",BlackRapid Breathe FR-5 FastenR,https://www.amazon.com/BlackRapid-020728-Breathe-FR-5-FastenR/dp/B01LFSFQCM/ref=pd_bxgy_2/135-4383232-8596804?_encoding=UTF8&pd_rd_i=B01LFSFQCM&pd_rd_r=0e28da79-b169-4d15-bced-062038e46514&pd_rd_w=ATfNl&pd_rd_wg=PXzvy&pf_rd_p=f325d01c-4658-4593-be83-3e12ca663f0e&pf_rd_r=V63W741C2S3GCH1YNHMC&psc=1&refRID=V63W741C2S3GCH1YNHMC
1033,B08VXCYGQW,"Xaperture Quick Release Rope Camera Wrist/Hand Straps for SLR/DSLR and mirrorless Cameras - Universal, Sturdy and Durable (Red)",,
1034,B07CGDFBF2,"Neewer Dimmable 176 LED Video Light with 2-Pack 2600mAh Li-ion Battery and Dual USB Battery Charger Lighting Kit for Canon, Nikon and Other Digital SLR Cameras for Photo Studio Video Shooting","Neewer 5.9x6.7 inches/15x17 centimeters Camera Collapsible Diffuser Mini Softbox for CN-160, CN-126…",https://www.amazon.com/Neewer-5-9x6-7-centimeters-Collapsible-Diffuser/dp/B00OXCGA28/ref=pd_bxgy_2/141-9522082-5535405?_encoding=UTF8&pd_rd_i=B00OXCGA28&pd_rd_r=62a0f5d3-7e91-4479-8c96-4645ce7fb7e0&pd_rd_w=cux3L&pd_rd_wg=Yw15H&pf_rd_p=f325d01c-4658-4593-be83-3e12ca663f0e&pf_rd_r=RHJR5S5MY0CVD2BDPVJB&psc=1&refRID=RHJR5S5MY0CVD2BDPVJB
1035,B00HQ4W1QE,Nikon D3300 24.2 MP CMOS Digital SLR with Auto Focus-S DX Nikkor 18-55mm f/3.5-5.6G VR II Zoom Lens (Black),SanDisk Ultra 64GB Class 10 SDXC UHS-I Memory Card up to 80MB/s (SDSDUNC-064G-GN6IN),https://www.amazon.com/SanDisk-Ultra-UHS-I-Memory-SDSDUNC-064G-GN6IN/dp/B0143IIP4W/ref=pd_bxgy_2/140-0851176-3381160?_encoding=UTF8&pd_rd_i=B0143IIP4W&pd_rd_r=90ebe92f-cf77-4ec6-8e5f-3048daf2c1b4&pd_rd_w=Slzzy&pd_rd_wg=PEB0r&pf_rd_p=f325d01c-4658-4593-be83-3e12ca663f0e&pf_rd_r=QFG1K9Q5QGXBBGFY9GTN&psc=1&refRID=QFG1K9Q5QGXBBGFY9GTN
1036,B08JHG8RKZ,"3.5mm TRS Male Mic Plug to 3.5mm TRS Male Mic Plug Jack Microphone Patch Cable Cord Wire for Canon, Nikon & Other DSLR Cameras with 3.5mm Mic Jack",On Camera Microphone Shock Mount Holder Bracket 3/8'' Screw Female Mount with 360° Left and Right…,https://www.amazon.com/Bracket-Rotation-VideoMicro-VideoMic-Microphone/dp/B07F7Z9JTY/ref=pd_bxgy_2/136-7006940-8245955?_encoding=UTF8&pd_rd_i=B07F7Z9JTY&pd_rd_r=a88effc2-43b7-4a5e-9010-27d581b2294b&pd_rd_w=U3K9L&pd_rd_wg=fHIHf&pf_rd_p=f325d01c-4658-4593-be83-3e12ca663f0e&pf_rd_r=QJJBGX0NAGSDHJCMGZE2&psc=1&refRID=QJJBGX0NAGSDHJCMGZE2
1038,B07258TNZD,Peak Design Leash Camera Strap (L-BL-3),Peak Design Cuff Camera Wrist Strap Black (CF-BL-3),https://www.amazon.com/Peak-Design-Camera-Wrist-CF-BL-3/dp/B07193B7TL/ref=pd_bxgy_2/139-1292615-3937553?_encoding=UTF8&pd_rd_i=B07193B7TL&pd_rd_r=50c5c2c6-6cba-4d6c-a980-28dae20620b2&pd_rd_w=Knlc7&pd_rd_wg=chVDQ&pf_rd_p=f325d01c-4658-4593-be83-3e12ca663f0e&pf_rd_r=QHV45YXFET795MM25HQ1&psc=1&refRID=QHV45YXFET795MM25HQ1
1039,B07G66LCFK,Think Tank Photo Hydrophobia DM 300-600 V3 Camera Rain Cover for DSLR and Sony Alpha Series Full-Frame mirrorless Cameras with Lenses ranging from 300mm-600mm f/2.8,,
1040,B08FX5R2KC,"CADeN Camera Bag Case Shoulder Messenger Bag with Tripod Holder Compatible for Nikon, Canon, Sony, DSLR SLR Mirrorless Cameras Waterproof Green","SanDisk 128GB Ultra SDXC UHS-I Memory Card - 100MB/s, C10, U1, Full HD, SD Card - SDSDUNR-128G-GN6IN",https://www.amazon.com/SanDisk-128GB-Ultra-UHS-I-Memory/dp/B07YFGG1SD/ref=pd_bxgy_2/133-5304342-2235734?_encoding=UTF8&pd_rd_i=B07YFGG1SD&pd_rd_r=6f24358e-9a0b-41bc-9e9d-2f2580918840&pd_rd_w=B6yDh&pd_rd_wg=ZscyX&pf_rd_p=f325d01c-4658-4593-be83-3e12ca663f0e&pf_rd_r=D5C2N7KMA751C23MJBSS&psc=1&refRID=D5C2N7KMA751C23MJBSS
1041,B06XW36KVB,"Boya by-MM1 Compact On Camera Shotgun Video Microphone YouTube Vlogging Facebook Livestream Recording Mic for iPhone Huawei Smartphone DJI Osmo Mobile Plus, for Canon Nikon Sony DSLR Cameras",,
1042,B005OL2ID2,Nikon D800E 36.3 MP CMOS FX-Format Digital SLR Camera (Body Only) (OLD MODEL),,
1043,B072YQDW78,"DaVoice 44mm Tripod Quick Release Plate Camera Mounting Adapter Parts Replacement for Amazon Basics 60-Inch, Ambico, Targus, Velbon, Vista Explorer 60”, Sony, Sunpak, Ravelli Tripod Mount QB-4W",Ailun Tripod Phone Mount Holder Head Standard Screw Adapter Rotatable Digtal Camera Bracket Selfie…,https://www.amazon.com/AILUN-Rotatable-Adjustable-Compatible-Camcorder/dp/B072KNBV21/ref=pd_bxgy_2/136-9237640-4210362?_encoding=UTF8&pd_rd_i=B072KNBV21&pd_rd_r=e28b4d00-0098-4813-80f4-f909cec6542c&pd_rd_w=w8k6y&pd_rd_wg=NKnRp&pf_rd_p=f325d01c-4658-4593-be83-3e12ca663f0e&pf_rd_r=Q4XZJEVK96ZM5HZD4WHW&psc=1&refRID=Q4XZJEVK96ZM5HZD4WHW
1044,B07PWLNWGX,"52mm Lens Cap Bundle, 3 Pack Universal Snap on Front Centre Pinch Lens Cover Set with Microfiber Lens Cleaning Cloth for Canon Nikon Sony Olympus DSLR Camera + Camera Lens Cleaning Pen",,
1047,B00M7MXOIY,"Neewer NW565EX E-TTL Slave Flash Speedlite with Flash Diffuser for Canon 5D Mark III,5D Mark II,7D,30D,40D,50D,300D,350D,400D,500D,550D,600D,700D,1000D,1100D and Other Canon DSLR Cameras",,
1049,B010XCEABO,Neewer NW561 LCD Display Flash Speedlite for Canon Nikon Panasonic Olympus Pentax Fijifilm and Sony with Mi Hot Shoe，DSLR and Mirrorless Cameras with Standard Hot Shoe,"Neewer Pro Universal Soft Mini Flash Bounce Diffuser Cap for On Camera or Off Camera Flash Gun, for…",https://www.amazon.com/Neewer-Universal-Diffuser-Olympus-Panasonic/dp/B00JUPDH5Q/ref=pd_bxgy_2/130-5328270-2943037?_encoding=UTF8&pd_rd_i=B00JUPDH5Q&pd_rd_r=f9a6fb29-b5cc-434f-a2db-1d37be709703&pd_rd_w=aXopx&pd_rd_wg=T8akM&pf_rd_p=f325d01c-4658-4593-be83-3e12ca663f0e&pf_rd_r=JMFFEM008WYDQRJBCW5C&psc=1&refRID=JMFFEM008WYDQRJBCW5C
1050,B07RXVP178,"Avella CD324 Carbon Fiber Video Monopod Kit, with Fluid Head and Removable feet, 71 Inch Max Load 13.2 LB for DSLR and Video Camera","SanDisk 128GB Extreme PRO SDXC UHS-I Card - C10, U3, V30, 4K UHD, SD Card - SDSDXXY-128G-GN4IN",https://www.amazon.com/SanDisk-128GB-Extreme-UHS-I-SDSDXXY-128G-GN4IN/dp/B07H9DVLBB/ref=pd_bxgy_2/134-2571613-1680503?_encoding=UTF8&pd_rd_i=B07H9DVLBB&pd_rd_r=2a00897e-91db-4e4e-a061-e6d08a98058d&pd_rd_w=P6UFC&pd_rd_wg=Ut1Gt&pf_rd_p=f325d01c-4658-4593-be83-3e12ca663f0e&pf_rd_r=EYX7C9HAQ6YP78E70C6G&psc=1&refRID=EYX7C9HAQ6YP78E70C6G
1054,B087M79HSS,Tiltaing Mini Matte Box MB-T15 for DSLR Mirrorless Style Cameras Tilta Lens Hood Accessories,,
1055,B000VDCT3C,Nikon AF-S FX NIKKOR 24-70mm f/2.8G ED Zoom Lens with Auto Focus for Nikon DSLR Cameras,,
1056,B08V16X67M,LRONG 3PCS Grey Card White Balance Card 18% Exposure Photography Card Custom Calibration Camera Checker Digital Video DSLR and Film with Lanyard Strap,,
1057,B01B6OTTIM,Canon EOS-1DX Mark II DSLR Camera (Body Only),,
1058,B07Q9QC7FX,"Saramonic UwMic9 96-Channel UHF Wireless Lavalier Microphone System Two Transmitters and One Receiver Compatible with Nikon Canon Sony DSLR Camera &Camcorders Smartphone for Video,Interview,ENG,TV",,
1059,B07F19K6SN,Slow Dolphin 1/4 Inch Hot Shoe Mount Adapter Tripod Screw for DSLR Camera Rig(2 Packs),,
1060,B073WCL4NS,"Regetek Camera Tripod Travel Monopod (70"" Aluminum Professional Video Camera Mount Leg) Adjustable Stand with Flexible Head for Canon Nikon Dv DSLR Camcorder Gopro Cam& Carry Bag & Cellphone Mount",,
1067,B07XD39ZNJ,"Ring Light 18"" with Tripod Stand, Dimmable LED Ring Light 3 Light Modes 2700-5500K with Carry Bag for Camera, iPhone, Ipad, Photography, Selfie, Video Shooting, Makeup & YouTube",,
1073,B08FJ3336N,Meike 85mm f1.8 Wide Aperture Full Frame Auto Focus Telephoto Lens for Nikon F Mount DSLR Camera and Compatible with APS-C Cameras D610 D750 D780 D810,,
1074,B08BFJ5KSG,"Wearable Microphone,Omnidirectional Vlogging Microphone for Podcast,ARISEN Professional Lavalier Microphone for Video Recording,19Feet Clip-on Lapel Mic,Compatible for DSLR,Camera,Android,Smartphone","External Video Microphone for Camera with Noise Isolate Shock Mount, Windbox Compact On-Camera Mic…",https://www.amazon.com/External-Microphone-Accessories-Compatible-Smartphone/dp/B08BFDLL8H/ref=pd_bxgy_2/139-3268165-5949451?_encoding=UTF8&pd_rd_i=B08BFDLL8H&pd_rd_r=eac0e188-3e99-4532-844c-01c138344b65&pd_rd_w=DOPgT&pd_rd_wg=oEfrE&pf_rd_p=f325d01c-4658-4593-be83-3e12ca663f0e&pf_rd_r=8769NWNSQHPB6Y61983Y&psc=1&refRID=8769NWNSQHPB6Y61983Y
1075,B08CGVM9PX,"Wireless Lavalier Microphone, LENSGO Mini 20-Channel Omnidirectional Wireless Lapel Mic for Android iPhone Smartphone Camcorder DSLR Camera Video Recording,Not for Amplifying (Black)",,
1076,B00ENSKUUK,"Neewer 6 x 5 inches/15 x 12.5 centimeters Translucent Softbox for Canon Nikon and Other DSLR Cameras Flashes,Neewer TT560 TT850 TT860 NW561 NW670 VK750II Flashes",Neewer TT560 Flash Speedlite for Canon Nikon Panasonic Olympus Pentax and Other DSLR Cameras，Digital…,https://www.amazon.com/Neewer-Speedlite-Panasonic-Cameras%EF%BC%8CDigital-Standard/dp/B004LEAYXY/ref=pd_bxgy_2/145-8807210-8090204?_encoding=UTF8&pd_rd_i=B004LEAYXY&pd_rd_r=41cc759e-a8f8-4544-bda5-31764686fd59&pd_rd_w=TY46m&pd_rd_wg=ADKfr&pf_rd_p=f325d01c-4658-4593-be83-3e12ca663f0e&pf_rd_r=8H0ANYPHD9KW4C78CR9F&psc=1&refRID=8H0ANYPHD9KW4C78CR9F
1077,B07FSKRRX9,"Neewer All Metal Wormdrive Macro Focusing Focus Rail Slider/Close-up Shooting Clamp Plate: 115mm Adjustment with 1/4 inch Screw Head for DSLR Cameras,Tripod Ballhead, Arca/RRS Lever Clamp Compatible","Camera Flash Diffuser,Eliminate Harsh Light and Shadow,Foldable with Storage Bag Easy Install Flash…",https://www.amazon.com/Diffuser-Eliminate-Foldable-Storage-Accessories/dp/B07VHPSGJX/ref=pd_bxgy_2/136-3146909-7149727?_encoding=UTF8&pd_rd_i=B07VHPSGJX&pd_rd_r=5f759d02-c995-4e00-9e68-2896c4eb45d3&pd_rd_w=E1Ega&pd_rd_wg=wA8ih&pf_rd_p=f325d01c-4658-4593-be83-3e12ca663f0e&pf_rd_r=PJ7KEW5118VJGTDE2Q78&psc=1&refRID=PJ7KEW5118VJGTDE2Q78
1085,B07TQLPVW2,4K Video Camera Camcorder ORDRO HDR-AE8 UHD 1080P 60FPS Digital WiFi Camera Camcorders IR Night Vision 3.0'' IPS Touchscreen Vlogging Camera with 32GB SD Card and 2 Batteries,"Webcam with Microphone,1080P Webcam Web Camera with Privacy Cover, HD USB Webcam Plug and Play with…",https://www.amazon.com/Microphone-1080P-Web-Camera-HD/dp/B08BBXZWQ3/ref=pd_bxgy_2/134-9319968-5700031?_encoding=UTF8&pd_rd_i=B08BBXZWQ3&pd_rd_r=9f186287-e2c2-4b2f-9935-cdb83f867a5a&pd_rd_w=ORkAM&pd_rd_wg=FAUYl&pf_rd_p=f325d01c-4658-4593-be83-3e12ca663f0e&pf_rd_r=9M8YDNDS7DP12JT61TXV&psc=1&refRID=9M8YDNDS7DP12JT61TXV
1088,B01N4Q3W98,"Elvam Universal Men and Women Camera Strap Belt Compatible with All DSLR Camera, SLR Camera, Instant Camera and Digital Camera - Green Vintage Flower Floral",SanDisk Ultra 64GB Class 10 SDXC UHS-I Memory Card up to 80MB/s (SDSDUNC-064G-GN6IN),https://www.amazon.com/SanDisk-Ultra-UHS-I-Memory-SDSDUNC-064G-GN6IN/dp/B0143IIP4W/ref=pd_bxgy_2/136-4566457-3898205?_encoding=UTF8&pd_rd_i=B0143IIP4W&pd_rd_r=2aeb1976-54b6-4174-8e17-77b8446d4a1d&pd_rd_w=xQZs0&pd_rd_wg=kNQQR&pf_rd_p=f325d01c-4658-4593-be83-3e12ca663f0e&pf_rd_r=KQRDXFADYZ5T8J9C7K4F&psc=1&refRID=KQRDXFADYZ5T8J9C7K4F
1091,B081JRGSQ5,"LUXCEO CRI95+ Super Slim LED Light Panel 1000LM LED Camera Video Light Built-in Rechargeable 4000mAh Battery, Stepless Dimming, 3000k-6000k, for All DSLR Cameras(Power Bank)","SanDisk 128GB Ultra SDXC UHS-I Memory Card - 100MB/s, C10, U1, Full HD, SD Card - SDSDUNR-128G-GN6IN",https://www.amazon.com/SanDisk-128GB-Ultra-UHS-I-Memory/dp/B07YFGG1SD/ref=pd_bxgy_2/136-7086378-2600704?_encoding=UTF8&pd_rd_i=B07YFGG1SD&pd_rd_r=eab2d128-2f09-4759-bb36-46530e74f5c1&pd_rd_w=oXYsw&pd_rd_wg=MUIIq&pf_rd_p=f325d01c-4658-4593-be83-3e12ca663f0e&pf_rd_r=E88JC2QFGJREQ6AE0KCG&psc=1&refRID=E88JC2QFGJREQ6AE0KCG
1108,B08HR5DJ3V,"InFocus Gear Photographer Backpack - Large Photography Bag for DSLR Camera, Laptop, Tripod, Lens & Accessories - Adjustable Dividers, Padded Shoulder & Waist Straps - Stylish Light Ergonomic Design",,
1109,B00DORFOBG,Vktech 5pcs Rear Lens Cap Cover for All Nikon AF AF-S DSLR SLR Camera LF-4 Lens,,
1110,B00017LSPI,Giottos AA1900 Rocket Air Blaster Large - Black,,
1111,B08G82DKSH,"CADeN Camera Backpack Bag for DSLR/SLR Mirrorless Camera with USB Charging Port Professional Waterproof, Camera Case Compatible for Sony Canon Nikon Camera and Lens Accessories",,
1112,B002P8CZ3A,Nikon D3000 10.2MP Digital SLR Camera Body Only,,
1113,B087CZ85GV,"RALENO LED Video Light, Built-in Rechargeable Battery 3200K-5600K Bi-Color Brightness CRI95+ with LCD Display, Dual Power Design USB Camera Light for Baby Photography, YouTube Video, Interviews","RALENO LED Video Soft Light Panel with LCD Display, for All Camera DSLR Photography, Built-in…",https://www.amazon.com/Photography-Brightness-3200K-5600K-Ultra-Thin-Portraits/dp/B07PMSBLTH/ref=pd_bxgy_2/141-1890773-7369130?_encoding=UTF8&pd_rd_i=B07PMSBLTH&pd_rd_r=a56d4409-8fbe-4a73-8f3f-1403ae0fc34a&pd_rd_w=lBNuS&pd_rd_wg=debQC&pf_rd_p=f325d01c-4658-4593-be83-3e12ca663f0e&pf_rd_r=HRRX9NVPVZ4P5V8JR0ES&psc=1&refRID=HRRX9NVPVZ4P5V8JR0ES
1115,B08RB27SVC,"UTEBIT Camera Hot Shoe Top Handle Grip with 1/4"" 3/8"" Screw Thread, Universal Video Stabilizer Rig with 3 Cold Shoe Adapters to Mount DSLR Camera with Microphone/LED Light/ Monitor/Phone/Magic Arm",,
1116,B07SV6NVDS,"Neewer 11 inches Adjustable Articulating Friction Magic Arm with Super Clamp, Robust Aluminum Alloy for DSLR/Mirrorless Cameras, Camcorders, LED Light, Flash Light, Field Monitor Video Vlog Rig",Neewer Super Clamp Crab Pliers Clip with 5/8 Inches Conversion Screw All-Metal Design for DSLR Rig…,https://www.amazon.com/Neewer-Conversion-All-Metal-Cameras-Umbrellas/dp/B07VHB7RJT/ref=pd_bxgy_2/144-6509447-1876327?_encoding=UTF8&pd_rd_i=B07VHB7RJT&pd_rd_r=cd195fc3-66d2-47b7-897a-c7d6d08dea32&pd_rd_w=tUiXA&pd_rd_wg=15vYd&pf_rd_p=f325d01c-4658-4593-be83-3e12ca663f0e&pf_rd_r=C0905CVWV880YD61GJ4B&psc=1&refRID=C0905CVWV880YD61GJ4B
1118,B0728HVDQ4,"BRENDAZ Standard Mini HDMI to HDMI Cable 10-feet for Canon EOS 5D Mark II, Mark III and EOS Rebel T7i 60D T6i T6 T6s T5 T5i DSLR Camera. (10-Feet)",,
1120,B089RNGX8L,4Pcs/Pack Universal 1-Axis Camera Spirit Level Hot Shoe Fixed Bubble Spirit Levels 3D Spirit Level for Canon Nikon Pentax DSLR Camera Photography Accessories (C-Color),,
1121,B01LNDARMS,Neewer 8mm F/3.5 Ultra Wide Angle Manual Focus Rectangle Fisheye Lens for APS-C DSLR Nikon D500 D3200 D3300 D3400 D5200 D5300 D5500 D5600 D7100 D7200 D7500 DSLR Cameras,,
1122,B01LFR7L9O,"BlackRapid Hybrid Breathe Camera Sling, Original Camera Sling Design, Strap for 1 or 2 DSLR, SLR and Mirrorless Cameras","SanDisk 64GB Extreme PRO SDXC UHS-I Card - C10, U3, V30, 4K UHD, SD Card - SDSDXXY-064G-GN4IN",https://www.amazon.com/SanDisk-64GB-Extreme-UHS-I-SDSDXXY-064G-GN4IN/dp/B07H9J1YXN/ref=pd_bxgy_2/134-8480563-4610862?_encoding=UTF8&pd_rd_i=B07H9J1YXN&pd_rd_r=8d023d3b-186d-42b0-a044-c3f93a8feb6d&pd_rd_w=UaBeP&pd_rd_wg=uCISD&pf_rd_p=f325d01c-4658-4593-be83-3e12ca663f0e&pf_rd_r=TSTTPTEWSZDGT90FWXN8&psc=1&refRID=TSTTPTEWSZDGT90FWXN8
1123,B08QSHF6N9,JULUCKY Black Wooden Handle Grip Ebony Handle for DSLR Camera Cage (Right),,
1124,B08R89QY72,NICEYRIG Ballhead Articulating Magic Arm with NATO Clamp Quick Release for DSLR Camera Gimbal Stabilizer Monitor LED Light - 314,,
1125,B08GCSTVQ1,Zhiyun Crane 2S Handheld Gimbal Stabilizer for DSLR Cameras， Handheld Gimbal Stabilizer for Camera Handheld Gimbal Stabilizer Cameras Professional Video Stabilizer Compatible with Sony Nikon Canon,,
1126,B00V3J4RDI,"Nikon Deluxe Digital SLR Camera Case - Gadget Bag for Df, D610, D750, D810, D7100, D7200, D5300, D5500, D5600, D3200, D3300, D3400",,
1127,B07K88FB7H,"Camera Flash Speedlite, SLFC Digital Camera Flashes with LCD Display, Electronic Flash for Canon/Nikon/Panasonic/Olympus/Pentax/Fujifilm, DSLR Camera Flash/Slave Flash with Standard Hot Shoe Mount","Neewer Pro Universal Soft Mini Flash Bounce Diffuser Cap for On Camera or Off Camera Flash Gun, for…",https://www.amazon.com/Neewer-Universal-Diffuser-Olympus-Panasonic/dp/B00JUPDH5Q/ref=pd_bxgy_2/131-9727372-5843802?_encoding=UTF8&pd_rd_i=B00JUPDH5Q&pd_rd_r=fe9972dc-6561-4e48-8453-b654665c7937&pd_rd_w=jftfq&pd_rd_wg=qUH6P&pf_rd_p=f325d01c-4658-4593-be83-3e12ca663f0e&pf_rd_r=VHVCSJW126VRASWFVP34&psc=1&refRID=VHVCSJW126VRASWFVP34
1128,B000HGMX5M,Nikon D80 DSLR Camera (Body only) (OLD MODEL),Nikon AF-S DX NIKKOR 18-55mm f/3.5-5.6G Vibration Reduction II Zoom Lens with Auto Focus for Nikon…,https://www.amazon.com/Nikon-18-55mm-3-5-5-6G-Vibration-Reduction/dp/B00HQ4W4PC/ref=pd_bxgy_2/143-4113689-2791744?_encoding=UTF8&pd_rd_i=B00HQ4W4PC&pd_rd_r=5cec20c3-9c6e-48ca-b271-73736f6c565e&pd_rd_w=aDUDj&pd_rd_wg=2gZ6Z&pf_rd_p=f325d01c-4658-4593-be83-3e12ca663f0e&pf_rd_r=QB2HSEEQA7QZZG58H24R&psc=1&refRID=QB2HSEEQA7QZZG58H24R
1129,B07848XYZV,"Neewer 3-in-1 16 Channels 2.4G Wireless Remote Flash Trigger with N1 and N3 Shutter Cables for Nikon DSLR Cameras Such as D7100, D7000,D800,D700,D600,D90,Speedlite Flash,VISION4 Studio Strobe (VC-16)",,
1130,B07VVP7HSK,UTEBIT 323 RC2 Quick Release Plate Compatible for Manfrotto 200PL-14 QR Plates Adapter with Rapid Connect Clamp and 1/4'' to 3/8'' Screw for DSLR Camera Tripod Ball Head,"Harwerrel Quick Release Plate 1/4"" Screw Fit for Bogen 3157N Manfrotto 200PL-14 323 RC2 3030 3130…",https://www.amazon.com/Harwerrel-Release-Manfrotto-200PL-14-Camera/dp/B07QKVBPCM/ref=pd_bxgy_2/136-8833530-4442445?_encoding=UTF8&pd_rd_i=B07QKVBPCM&pd_rd_r=5cf3dd8a-8aef-498b-b0b9-6728a01cc11b&pd_rd_w=oAplH&pd_rd_wg=NehqY&pf_rd_p=f325d01c-4658-4593-be83-3e12ca663f0e&pf_rd_r=WMS1T75HSPC7W4GGMCKP&psc=1&refRID=WMS1T75HSPC7W4GGMCKP
1131,B0881JGZDV,"IFOOTAGE Universal Quick Release Plate Camera Mount with 1/4"" & 3/8"" Screw, Seastars Q1 Rapid Connect Adapter for DSLR Camera Camcorder Tripod, Monopod, Slider","IFOOTAGE Video Tripod Head Fluid Drag Pan Head for DSLR Cameras, Camcorder, Monopod and Tripods",https://www.amazon.com/IFOOTAGE-Cameras-Camcorder-Monopod-Tripods/dp/B07GR211GZ/ref=pd_bxgy_2/137-3531948-0822009?_encoding=UTF8&pd_rd_i=B07GR211GZ&pd_rd_r=09a83fef-c082-466c-8387-dc89d938dc30&pd_rd_w=wmn78&pd_rd_wg=rLvdv&pf_rd_p=f325d01c-4658-4593-be83-3e12ca663f0e&pf_rd_r=6A13SSV7DBBCKXS1X3F3&psc=1&refRID=6A13SSV7DBBCKXS1X3F3
1132,B00007EDZG,Nikon ML-L3 Wireless Remote Control,,
1133,B00H7WFUVI,"Neewer A-B Stop Follow Focus C2 with Gear Ring Belt for DSLR Cameras Such as Nikon,Canon,Sony DV/Camcorder/Film/Video Cameras,Fits 15mm Rod Mounts,Shoulder Supports",,
1134,B083GHQ5F4,"SabineTek SmartMike+ Wireless Microphone System, Lavalier Lapel Mic for Canon, Nikon, Sony, Panasonic, DSLR Camera, GoPro, Phone, PC, Vlogging Youtuber Recording",,
1135,B07RWZ4JL1,"Case Logic ERA DSLR Camera Backpack, Medium, Black/ Grey",,
