,ASIN,name,freq_bought,freq_bought_link
1962,B00CFHBBDG,"Multi Color Neck Strap, Shoulder Belt Strap, Vintage Camera Straps for Canon Fuji Nikon Sony Olympus Samsung Pentax Olympus Cameras",,
1963,B079QJZFWT,"Camera Hand Grip Strap JJC DSLR Wrist Strap for Canon 7D 6D 5D 5Ds 5Ds R 1Dx T7 T6 T5 T3 T7i T6s T6i T5i SL2 SL1 80D 77D Nikon D5 D4s D4 D850 D810 D3400 D7500 D7200 D5600 D5500,etc",,
1964,B00908BMVE,Canon PowerShot SX500 IS 16.0 MP Digital Camera with 30x Wide-Angle Optical Image Stabilized Zoom and 3.0-Inch LCD (Black) (OLD MODEL),,
1965,B08RDL8BBF,NICEYRIG M5x16mm Flat Knurled Head Thumb Screw Bolt for DSLR Shoulder Rig/Camera Baseplate / 15mm Rod Clamp [Pack of 4] - 069,,
1966,B084M54R5S,Vizemo 6-Pack Lens Cover Cap Holder Keeper Anti-Loss Strap，Lens Cap Leash Keeper Holder for DSLR Camera,,
1967,B0038YWLCU,"JOBY GorillaPod Ballhead X for Focus. Quick Release Ballhead for Tripods, Videos Cameras, and Pro DSLR Cameras w/Zoom Lenses up to 5kg (11.1lbs)",,
1968,B07DWLFBMD,"HD 20-60x80 Spotting Scope, Waterproof Dual Focusing Zoom BAK4 Fully Multi Coated 45 Degree Angled Eyepiece for Hunting Archery Shooting Targets Bird Watching with Smartphone Adapter",,
1969,B017L1QGU8,Garmin Nuvi 57LM 5-Inch GPS Navigator (Renewed),,
1970,B08R9J16VM,"Basicolor Game Capture Card 4k, Video HDMI USB3.0 Capture Card for Live Streaming and Recording, Gaming Capture for Nintendo Switch PS3/4/5 Xbox Will U DSLR.with HDMI Pass-Through Zero Latency",,
1971,B08B1RBMFQ,"SOUTHSKY 4K HDMI Video Capture Card USB 2.0, Output 1080p,Mini Size, Compatible with PC,Laptop,Zoom, OBS, VLC for Webcam, Camera, Conference, Live Broadcasting, Recording",,
1972,B07PJNRFXF,"CharJenPro USB C Hub for MacBook Pro 16"", 15"", 13"", 2020, 2019, 2018, MacBook Air 2020, 2019, 2018, 100W Power, HDMI 4K, 2 USB 3.0, microSD, SD Card Reader, USB C Port. USBC Adapter.","Afterplug Dual Type-C Short Extender, USB-C Thunderbolt 3 Female to Male Extension Adapter, 40Gbps…",https://www.amazon.com/Afterplug-Extender-Extension-Adapter-Delivery/dp/B0828XK1V5/ref=pd_bxgy_2/145-4185387-5320817?_encoding=UTF8&pd_rd_i=B0828XK1V5&pd_rd_r=e778f314-a535-439a-849a-bb20bc9aef95&pd_rd_w=cXGp7&pd_rd_wg=b9YBh&pf_rd_p=f325d01c-4658-4593-be83-3e12ca663f0e&pf_rd_r=03HFYXC03F2ZPRG7YEGV&psc=1&refRID=03HFYXC03F2ZPRG7YEGV
1973,B07X9V4VMV,"𝐍𝐞𝒘 𝐘𝐞𝐚𝐫'𝐬 𝐃𝐞𝐚𝐥 Tripod Waist Bag, Portable Waterproof Waist Bag Pouch Pocket Case Pack for Supporting Camera Tripod Photography Belt Pocket, New Year‘s Gift",,
1974,B07T8BSKFP,PNY 16GB Performance Class 4 microSDHC Flash Memory Card 2-Pack (P-SDU16G4X2-GE),"Anker 2-in-1 USB 3.0 SD Card Reader for SDXC, SDHC, SD, MMC, RS-MMC, Micro SDXC, Micro SD, Micro…",/Anker-Portable-Reader-RS-MMC-Micro/dp/B006T9B6R2/ref=pd_bxgy_2/145-3036318-0736009?_encoding=UTF8&pd_rd_i=B006T9B6R2&pd_rd_r=75ca8ac3-1a7f-4a04-8f98-0a4231001fdc&pd_rd_w=ZPyzP&pd_rd_wg=taHat&pf_rd_p=f325d01c-4658-4593-be83-3e12ca663f0e&pf_rd_r=6K7T2EBKWQH46QW90H0M&psc=1&refRID=6K7T2EBKWQH46QW90H0M
1975,B00FF3X34M,Extech LT40 LED Light Meter,Bosch Blaze Pro 165' Laser Distance Measure GLM165-40,/Bosch-Distance-Measure-165-Feet-GLM165-40/dp/B076C3TB8P/ref=pd_bxgy_2/133-3337901-2595257?_encoding=UTF8&pd_rd_i=B076C3TB8P&pd_rd_r=5d784fa8-3612-44b5-b128-60edf03e94cb&pd_rd_w=0zu4x&pd_rd_wg=Q0BMC&pf_rd_p=f325d01c-4658-4593-be83-3e12ca663f0e&pf_rd_r=AARWF5XFXQGXSM5862H2&psc=1&refRID=AARWF5XFXQGXSM5862H2
1977,B07JYJ5ZGL,YOKEPO 6-Inch Wide Platform Solid Screen Shelf Adjustable Mount Desktop PC Monitor Used to Place Cable Box Speakers Apple TV Playstation Camera Frames Remote - Black,,
1978,B012PL522W,Lexar Professional 2000x 128GB SDXC UHS-II Card (LSD128CBNA2000R),,
1979,B08C9MQZ5N,"Webcam with Microphone,Elejolie HD Webcam 1080p Web Camera USB 2.0 Web Cam for Live Streaming",,
1980,B083P66G5H,"2 Pack of 32GB Micro SD Card with Adapter,Class10 MicroSDHC Card for Nintendo Switch, Class 10 Memory Card for Android Smartphone Digital Camera Tablet and DJI Drone",,
1981,,"Pasow Mini USB Charging Cable USB 2.0 A-Male to Mini-B Car Vehicle Power Charger Adapter Cord for Dash Cam GPS Rearview Mirror Cam Backup Camera (15FT, Right Angle)","Anker Car Charger, Mini 24W 4.8A Metal Dual USB Car Charger, PowerDrive 2 Alloy Flush Fit Car…",https://www.amazon.com/Anker-Charger-PowerDrive-Adapter-iPhone/dp/B07PGT7LSR/ref=pd_bxgy_2/144-7118353-2950316?_encoding=UTF8&pd_rd_i=B07PGT7LSR&pd_rd_r=cb11fdbd-04b0-42e3-acc9-4bb51f92d467&pd_rd_w=v1M1U&pd_rd_wg=YZujN&pf_rd_p=f325d01c-4658-4593-be83-3e12ca663f0e&pf_rd_r=03KZ5J9FD0TW48ANDQC9&psc=1&refRID=03KZ5J9FD0TW48ANDQC9
1982,B08NT6R91K,"VICSEED Phone Tripod, 59"" Extendable Tripod for iPhone & Android Phones Bluetooth Remote Selfie Stick Tripod Camera Tripod Stable Base Lightweight Selfie Stick Detachable Design",,
1983,,"David Busch's Mastering Digital SLR Photography, Third Edition 252-Page Softcover Book",,
1984,B07NWPQL9D,"64GB SD Memory Card | SD Card Compatible with Panasonic Lumix Series DMC-FZ62, DMC-FZ200, DMC-FT25, DMC-FZ70, DMC-FT4, DMC-FT20, DMX-XS1, DMC-TZ25, DMC-TZ30, DMC-TZ35, DMC-TZ80 Camera | 64 GB",,
1985,B082XPL6NB,Godox TT600S HSS 1/8000s High-Speed Sync Built-in 2.4G Wireless X System Flash Speedlite with FB 4AA Rechargeable Batteries&Charger Compatible for Sony Digital DSLR Camera,,
1986,B07GKXTDY1,"BOYA BY-M1DM Dual Lavalier Microphones, Omnidirectional Condenser Clip-on Lapel Mic for Camera DSLR iPhone Android Smartphone Samsung Huawei Sony Laptop Interview YouTube","Headsets Splitter Adapter, 3.5mm Jack Separate Headphone & Mic Plug Adapter 3.5mm Combo Audio…",https://www.amazon.com/Headsets-Splitter-Separate-Headphone-Nintendo/dp/B07FB8LCQ7/ref=pd_bxgy_2/144-8742259-9462133?_encoding=UTF8&pd_rd_i=B07FB8LCQ7&pd_rd_r=960aa171-4c02-456a-95d1-f75bdef55df0&pd_rd_w=rITkq&pd_rd_wg=pArbK&pf_rd_p=f325d01c-4658-4593-be83-3e12ca663f0e&pf_rd_r=940E1NC0THKATTFNX1YS&psc=1&refRID=940E1NC0THKATTFNX1YS
1987,B08HMKDYCZ,Desview T2 Teleprompter for Canon Nikon Sony Camera Photo Studio DSLR Mirrorless Camera Tablet Smartphone with Remote Control and Lens Adapter Ring for Recording Vlog YouTube Interview,,
1988,B07XQ67JB6,"Shotgun Microphone MAONO AU-CM10 Super-Cardioid Camera Condenser Video Interview Mic Compatible with Canon, Nikon, Sony DSLR Cameras, Camcorder, PC, Phone, Android",,
1989,B01MT0ZPQM,Neewer Professional Camera Storage Sling Bag Waterproof Shockproof Tearproof Partition Protection Case for Canon Nikon Sony Pentax Olympus Fujifilm Panasonic Dslrs and Mirrorless Cameras(Red Interior),"SanDisk 128GB Ultra SDXC UHS-I Memory Card - 100MB/s, C10, U1, Full HD, SD Card - SDSDUNR-128G-GN6IN",https://www.amazon.com/SanDisk-128GB-Ultra-UHS-I-Memory/dp/B07YFGG1SD/ref=pd_bxgy_2/145-3546165-3166263?_encoding=UTF8&pd_rd_i=B07YFGG1SD&pd_rd_r=1c52d9f3-8279-4844-b570-78cc3e0d7c19&pd_rd_w=IpemT&pd_rd_wg=ygklI&pf_rd_p=f325d01c-4658-4593-be83-3e12ca663f0e&pf_rd_r=FJG03ZDSPQJTCKKEHJ95&psc=1&refRID=FJG03ZDSPQJTCKKEHJ95
1990,B08FR9KXHC,"CADeN Camera Bag Case Shoulder Messenger Bag Compatible for Nikon, Canon, Sony, DSLR SLR Mirrorless Cameras and Lenses Black",,
1991,B07GZPW193,"GPS-N Plus High-Precision Camera GPS Receiver Navigation Geotagging for Nikon D3100, D3200, D3300, D5000, D5100, D5200, D5300, D7000, D7100, D600, D610, D800, D810, D700, D750, D90, D4, D3 etc","SanDisk 64GB Extreme PRO SDXC UHS-I Card - C10, U3, V30, 4K UHD, SD Card - SDSDXXY-064G-GN4IN",https://www.amazon.com/SanDisk-64GB-Extreme-UHS-I-SDSDXXY-064G-GN4IN/dp/B07H9J1YXN/ref=pd_bxgy_2/136-6946284-1942742?_encoding=UTF8&pd_rd_i=B07H9J1YXN&pd_rd_r=79c4f887-4854-44ba-9e9b-8e278e48088a&pd_rd_w=AUwDi&pd_rd_wg=PPX2m&pf_rd_p=f325d01c-4658-4593-be83-3e12ca663f0e&pf_rd_r=FXX5AETR0DX9PJEP8MXQ&psc=1&refRID=FXX5AETR0DX9PJEP8MXQ
1992,B081RBTJKD,"Neewer Upgraded 176S Version, 264 LED Video Light with SMD LED Beads, LED Light Panel Dimmable for DSLR Camera Camcorder, 3200K-5600K Bi-Color, White Filter and LCD Display (Battery Not Included)","Neewer NP-F550 Battery Charger Set for Sony NP F970,F750,F960,F530,F570,CCD-SC55,TR516,TR716,and…",https://www.amazon.com/Neewer-NP-F550-Battery-CCD-SC55-Replacement/dp/B06XDC47YM/ref=pd_bxgy_2/133-4060586-8101668?_encoding=UTF8&pd_rd_i=B06XDC47YM&pd_rd_r=b3c0526a-15b9-4140-8d50-260d78ebb163&pd_rd_w=FB9gA&pd_rd_wg=7nHkb&pf_rd_p=f325d01c-4658-4593-be83-3e12ca663f0e&pf_rd_r=G7H6W9P7EY81ZS8S3HVZ&psc=1&refRID=G7H6W9P7EY81ZS8S3HVZ
1994,B00FUH58RS,"Foto&Tech Clear Medium Battery Storage Case/Organizer/Holder Compatible with Nikon Canon DSLR Camera Rechargeable Li-Ion/AA/AAA / 9V Battery (5 PCS, Clear)",Whizzotech AA/AAA Cell Battery Storage Case/Holder with Charge Reminder Markings Clear Color (6 Pack…,https://www.amazon.com/Whizzotech-Battery-Storage-Reminder-Markings/dp/B00TF8FSZ0/ref=pd_bxgy_2/132-2939363-2212369?_encoding=UTF8&pd_rd_i=B00TF8FSZ0&pd_rd_r=9eaac641-38b5-4a05-a2f7-e3f5f826a789&pd_rd_w=gIvOi&pd_rd_wg=3AQn7&pf_rd_p=f325d01c-4658-4593-be83-3e12ca663f0e&pf_rd_r=FHBWS5GQ341A7N8K1Y7F&psc=1&refRID=FHBWS5GQ341A7N8K1Y7F
1995,B08DFWL66K,SmallRig Super Mini Top Handle for DSLR Camera Cage Kit Rig (w/Shoe Base),,
1996,B077PQKYR4,"Neewer 3-in-1 16 Channels 2.4G Wireless Remote Flash Trigger with C1 and C3 Shutter Cables for Canon DSLR Cameras Such as 5D Mark II III IV 1100D, Speedlite Flash, VISION4 Studio Strobe (VC-16)",Neewer 24 inches/60 centimeters Octagon Softbox with Bowens Mount Speedring and Bag for Speedlite…,https://www.amazon.com/Neewer-centimeters-Speedring-Speedlite-Photography/dp/B00QT7NURS/ref=pd_bxgy_2/131-5789140-7879243?_encoding=UTF8&pd_rd_i=B00QT7NURS&pd_rd_r=5f39e7b5-f45c-4ae4-8698-8f2c47ba827b&pd_rd_w=RD4qE&pd_rd_wg=kXFh7&pf_rd_p=f325d01c-4658-4593-be83-3e12ca663f0e&pf_rd_r=2AFG36A3FH4PQD0GV8TB&psc=1&refRID=2AFG36A3FH4PQD0GV8TB
1997,B08JTH78D1,"F5 Pro V2 5.5"" Touch Screen DSLR Camera Field Monitor 3D LUT 4K HDMI Input Output Tilt Arm Power Output F970 Install and Power Kit to External Wireless Transmission LED Light","Fireproof Money Bag Two Pockets Two Zippers,Quctak Fireproof Safe Bag 10.6""x6.7"" Waterproof and…",https://www.amazon.com/Fireproof-Pockets-Quctak-Waterproof-Passport/dp/B07ZCG4MCV/ref=pd_bxgy_2/145-0339569-9830530?_encoding=UTF8&pd_rd_i=B07ZCG4MCV&pd_rd_r=bc36afec-25f4-420f-8c43-ce4df7465dce&pd_rd_w=PVMnm&pd_rd_wg=leVEe&pf_rd_p=f325d01c-4658-4593-be83-3e12ca663f0e&pf_rd_r=6HP3BPEJ5GWFT6952AY9&psc=1&refRID=6HP3BPEJ5GWFT6952AY9
1998,B000B68LSG,Canon BG-E4 Battery Grip for EOS 5D Digital SLR Camera (Retail Package),,
1999,B00009XV7A,Nikon TC-14E II (1.4x) Teleconverter AF-S for Nikon Digital SLR Cameras (OLD MODEL),,
2000,B00I8BIB1S,Sony DSCWX350 18 MP Digital Camera (Black),SanDisk Ultra 32GB Class 10 SDHC UHS-I Memory Card up to 80MB/s (SDSDUNC-032G-GN6IN),/SanDisk-Ultra-Class-Memory-SDSDUNC-032G-GN6IN/dp/B0143RT8OY/ref=pd_bxgy_2/135-4217972-9928116?_encoding=UTF8&pd_rd_i=B0143RT8OY&pd_rd_r=a1a333ab-ad56-42bd-8479-1218524d7748&pd_rd_w=Hxrx6&pd_rd_wg=wyAPS&pf_rd_p=f325d01c-4658-4593-be83-3e12ca663f0e&pf_rd_r=KDZTDEW5DHV2E6T6WECC&psc=1&refRID=KDZTDEW5DHV2E6T6WECC
2001,B06WP7FR2F,"Neewer 49MM Lens Filter and Accessory Kit, Includes: UV CPL FLD Filters, Macro Close Up Filter Set(+1 +2 +4 +10), ND2 ND4 ND8 Filters, Pouch Cap Hood, Fit for Sony Alpha A3000, NEX Series DSLR Cameras","SanDisk 128GB Extreme PRO SDXC UHS-I Card - C10, U3, V30, 4K UHD, SD Card - SDSDXXY-128G-GN4IN",https://www.amazon.com/SanDisk-128GB-Extreme-UHS-I-SDSDXXY-128G-GN4IN/dp/B07H9DVLBB/ref=pd_bxgy_2/139-7167113-9969920?_encoding=UTF8&pd_rd_i=B07H9DVLBB&pd_rd_r=e1b67d58-299b-483e-8b48-c94f0b67c467&pd_rd_w=xmyoj&pd_rd_wg=ns8HV&pf_rd_p=f325d01c-4658-4593-be83-3e12ca663f0e&pf_rd_r=0YDR6WP5K8KHE5DYPD52&psc=1&refRID=0YDR6WP5K8KHE5DYPD52
2003,B00KNQHT0A,Voking V900 Master TTL Speedlite Flash for Nikon D3400 D3300 D3200 D5600 D850 D750 D7200 D5300 D5500 D500 D7100 D3100 D3500 and Other Nikon DSLR Cameras,,
2004,B0044LXK3A,Aquapac Waterproof DSLR Camera Case (458),,
2005,B07PZ1FJ8S,"Camera Body Cap and Lens Rear Cap Cover Replacement Set for All Nikon DSLR Cameras D850 D810 D750 D7200 D610 D7100 D5300 D7000 D800 D5 D7500,2 Sets",,
2014,B08F38P5WC,Lammcou Mini Tripod Ballhead 360 Degree Rotatable Tripod Head with Dual Kugelkopf Mini Magic Arm & Screw Coverter for DSLR Cameras Tripods Monopods Rig Vlogging Live Streaming Accessories,Garsumiss Yoga Mats TPE Non Slip 6MM Thick All Purpose Workout Mat for Yoga Pilates and Floor…,https://www.amazon.com/Garsumiss-Purpose-Workout-Pilates-Exercises/dp/B089T3LPYY/ref=pd_bxgy_2/145-0726657-8872942?_encoding=UTF8&pd_rd_i=B089T3LPYY&pd_rd_r=8bd0241e-03e7-4357-9333-374dfaef56b7&pd_rd_w=bY7Vd&pd_rd_wg=aHCKc&pf_rd_p=f325d01c-4658-4593-be83-3e12ca663f0e&pf_rd_r=GN2430AQ8WF26WWTT0J8&psc=1&refRID=GN2430AQ8WF26WWTT0J8
2030,B07S1YMFHJ,"Godox TT685S TTL Flash Speedlite for Sony Camera HSS 1/8000S & Godox X1T-S 2.4G TTL Wireless Flash Trigger,Compatible for Sony DSLR Cameras a77II a7RII a7R a58 a99 ILCE6000L",,
2034,B07ZSVK5QP,ANDYCINE Rhino Monitor Mount Tilting Up to 180 Degree and Swivel 360 Degree Monitor Stand with 4mm Olven Cable Slot fit for Camera Cages,,
2036,B0894VMD23,Desview T2 Portable Teleprompter Kit with Remote Control for Smartphone iPad Mini Canon Nikon Sony DSLR Camera for YouTube Interview Video,Professional Grade Lavalier Lapel Microphone Omnidirectional Mic with Easy Clip On System Perfect…,https://www.amazon.com/Professional-Microphone-Omnidirectional-Recording-Conference/dp/B01AG56HYQ/ref=pd_bxgy_2/139-7526706-5900029?_encoding=UTF8&pd_rd_i=B01AG56HYQ&pd_rd_r=0725e776-0d97-4a69-a32e-487d1aacc973&pd_rd_w=LRzYK&pd_rd_wg=NWZXg&pf_rd_p=f325d01c-4658-4593-be83-3e12ca663f0e&pf_rd_r=FS16T0276MWEY5C37JYA&psc=1&refRID=FS16T0276MWEY5C37JYA
2037,B00UNNQQ34,"MegaGear MG504 SLR, DSLR Camera Leather Wrist Strap",,
2038,B00007E7K1,Canon RF-3 Body Cap for EOS SLR Cameras,"58mm Snap-On Lens Cap for CANON Rebel (T4i T3i T3 T2 T2i T1i XT XTi), CANON EOS (1100D 650D 600D…",/58mm-Snap-CANON-Rebel-1100D/dp/B00K4U3Y68/ref=pd_bxgy_2/141-9425931-1017649?_encoding=UTF8&pd_rd_i=B00K4U3Y68&pd_rd_r=68d96847-de78-424f-be89-cc2ffbada56a&pd_rd_w=egrEl&pd_rd_wg=wFxYg&pf_rd_p=f325d01c-4658-4593-be83-3e12ca663f0e&pf_rd_r=RMACVVD4K5HY2VE742PH&psc=1&refRID=RMACVVD4K5HY2VE742PH
2039,B077WKCV2V,Hahnel PROCUBE2 Professional Twin Battery Charger for Fujifilm/Panasonic DSLR Cameras,,
2040,B08D7QTZFC,Luhappy Video Action Stabilizing Handle Grip Handheld Stabilizer with Hot-Shoe Mount for Canon Nikon Sony Panasonic Pentax Olympus DSLR Camera Camcorder,,
2042,B08F49WXRP,"Canada Style 2021Made Camera Bag Backpack Compatible(Canon Sony Nikon)Waterproof Shockproof Photographer Case With Tripod Holder For DSLR/SLR,Mirrorless,Laptop Flash Camera 0099 Nylon Made Large(blue)",,
2043,B07NXPLBJN,"SOONWELL V-Mount Plate Power Supply with LP-E6 Dummy Battery 15mm Rod Bracket for DSLR RED Cameras,Camcorders, Monitors",,
2045,B082SKC522,"Socialite Ring Light - 19” Dimmable LED Lighting Kit w/Travel Bag for YouTube, Webinar, Social Media Photos - Remote Controlled Studio Lights w/ 6ft Stand - Works w/DSLR Camera, Smartphones & iPad",Socialite Professional Grade Studio Quality Clip-on Lavalier Lapel Omnidirectional Condenser…,https://www.amazon.com/Socialite-Professional-Omnidirectional-Microphone-Smartphones/dp/B08112TYRP/ref=pd_bxgy_2/130-2809315-1551330?_encoding=UTF8&pd_rd_i=B08112TYRP&pd_rd_r=11650260-6b16-461f-b941-20116c1d22c5&pd_rd_w=nUA7N&pd_rd_wg=dgMEU&pf_rd_p=f325d01c-4658-4593-be83-3e12ca663f0e&pf_rd_r=DKHHRZXF0WE1XBH37V6F&psc=1&refRID=DKHHRZXF0WE1XBH37V6F
2046,B07SD458JY,"200mm (7.87"") Long 15mm Cheese Rod Rail Riser 1/4"" Thread Cheese Plate Bar for DSLR Camera Video Camcorder Cage Grip Rig",,
2047,B08352R6YS,Red Black Universal Nylon Braided Adjustable Camera Hand Wrist Strap for Binoculars/Nikon/Canon/Sony/Minolta/Panasonic/SLR/DSLR Digital Cameras,,
2048,B07MTVY5QB,"Saramonic 5.8GHz VMicLink5 Wireless Lavalier Lapel Microphone System with 3 Bodypack Transmitter,1 Portable Receiver Compatible with Canon EOS Nikon Sony DSLR Camera Panasonic Camcorder News Gathering",,
2049,B086895P1X,"Easy Hood UURig Cage for Canon EOS 90D 80D 70D Camera, Aluminum Video Film Movie Making Rig Stabilizer with 1/4"" 3/8"" Mounting Points and Cold Shoe for Mic Monitor Fill Light Vlogging Accessories",,
2050,B08HVXJZYY,Sony Alpha 7C Full-Frame Compact Mirrorless Camera Kit - Silver (ILCE7CL/S),,
2051,B07V5DY4QC,"Rangeland Compact Travel Carry-on Camera Backpack for Photographers for DSLR, Mirrorless Cameras, Laptop, Passport, Tripod, Lenses, Accessories and Personal Items",,
2052,B07GV9L2SX,"KingBra New 6pcs Quick Install Metal Screw for Quick Release Neck Strap/R-Strap/Neck Sling Strap, 1/4 Screw Mouth Designed for Holder for DSLR/SLR/Evil Camera with Quick Mounting","4 Packs Camera Tether Safety Strap, SourceTon Camera Strap for DSLR Camera and Mirrorless…",https://www.amazon.com/Camera-SourceTon-Mirrorless-Professional-Cameras/dp/B07GCKMMPM/ref=pd_bxgy_2/141-9037670-5244225?_encoding=UTF8&pd_rd_i=B07GCKMMPM&pd_rd_r=69d232ef-ce54-4ec0-beff-45afa8629242&pd_rd_w=LKoQz&pd_rd_wg=8XaU2&pf_rd_p=f325d01c-4658-4593-be83-3e12ca663f0e&pf_rd_r=8SHDHFXR5ZE75FMK2Y98&psc=1&refRID=8SHDHFXR5ZE75FMK2Y98
2054,B08CKH7526,HangTon Dummy Battery DMW-DCC8 DC Coupler and AC Power Adapter for DMW-BLC12 PANASONIC LUMIX GH2 G5 G6 G7 FZ300 DSLR Camera (DMW-DCC8+Adapter),,
2055,B00HNZTJ48,Shockproof DSLR Camera Insert Sleeve Organizer with Removable Partitions-Make Your own DSLR Camera Bag-Blue,,
2056,B00OUKQOQA,Neewer FC-16 Multi-Channel 2.4GHz 3-IN-1 Wireless Hot Shoe Flash Receiver for Canon and Nikon DSLR Cameras,Neewer FC-16 3-IN-1 2.4GHz Wireless Flash Trigger with Remote Shutter Compatible with Canon Rebel T3…,https://www.amazon.com/Neewer-Multi-Channel-Wireless-Trigger-Shutter/dp/B00OUKQOLA/ref=pd_bxgy_2/136-4094807-0716256?_encoding=UTF8&pd_rd_i=B00OUKQOLA&pd_rd_r=e0489ce7-66a9-4eb2-81ef-cac2dadf67ee&pd_rd_w=6r1m8&pd_rd_wg=6knyF&pf_rd_p=f325d01c-4658-4593-be83-3e12ca663f0e&pf_rd_r=VVP6H49T39SEFR7C50ZY&psc=1&refRID=VVP6H49T39SEFR7C50ZY
2057,B08V9643XG,"Quluxe Camera L Bracket Mount, Video Grip L-Bracket with Cold Shoe Mount 1/4'' Tripod Screw, Heavy Duty Padded Hand Grip for DSLR Camera Camcorder",,
2075,B00RMTD8XS,Neewer Battery Grip Pack Replacement for Nikon MB-D16 compatible with EN-EL15 Battery for Nikon D750 DSLR Camera,"EN-EL15 EN EL15a RAVPower Battery Charger Set Compatible with Nikon d750, d7200, d7500, d850, d610…",https://www.amazon.com/EN-EL15-RAVPower-Battery-Compatible-Batteries/dp/B01JG6QWUA/ref=pd_bxgy_2/144-4343094-1107012?_encoding=UTF8&pd_rd_i=B01JG6QWUA&pd_rd_r=95537141-9abf-4233-af58-4d304d679a54&pd_rd_w=l6emK&pd_rd_wg=981aJ&pf_rd_p=f325d01c-4658-4593-be83-3e12ca663f0e&pf_rd_r=1KYH7BKNSV8JMRQ5NG9F&psc=1&refRID=1KYH7BKNSV8JMRQ5NG9F
2076,B00F1U302E,"SunSmart Pro DSLR Rig Video Camera Shoulder Mount Kit Including DSLR Rig Shoulder Support, Follow Focus and Matte Box for All DSLR Video Cameras and DV Camcorders",,
2078,B08FTDX7DY,"On-Camera Microphone, SAIREN Camera Microphone Mini Vlog Mic for Canon/Nikon/Sony Camera,DSLR,Gopro,Camcorders,Smartphone,iPhone, Interview Camera Mic for Recording YouTube Tiktok Livestream",,
2079,B019UDI3JC,Canon PowerShot ELPH 360 Digital Camera w/ 12x Optical Zoom and Image Stabilization - Wi-Fi & NFC Enabled (Purple),,
2080,B07C7WYZQX,"2 Packs LED Video Photography Lighting Kit, Panel Studio Lights with Stand, VL-200T Bi-Color Dimmable Photo Lighting for YouTube Video Shooting, Wireless Remote, AC Adapter, Carry Bag (Included)","LEPOWER 50W LED Flood Light Outdoor, Work Light with Plug, IP66 Waterproof Outdoor LED Lights Super…",https://www.amazon.com/LEPOWER-Waterproof-Floodlight-Basketball-Playground/dp/B07DN9M8J5/ref=pd_bxgy_2/131-4218256-7785344?_encoding=UTF8&pd_rd_i=B07DN9M8J5&pd_rd_r=f4ccffd3-f336-4da5-8b7f-c358be618791&pd_rd_w=6M8Ue&pd_rd_wg=2v18q&pf_rd_p=f325d01c-4658-4593-be83-3e12ca663f0e&pf_rd_r=N0SX6HERXR90S7NS81TB&psc=1&refRID=N0SX6HERXR90S7NS81TB
2081,B07LCV9WL1,"iBOLT 10 inch Tripod Camera Slider Bar with 3 Camera (_ inch) Screw attachments- Great for Adding Additional Microphones, LED Lights, Camera Flash, Monitors, etc.- DSLR Cameras, GoPros, Video Cameras",Ailun Tripod Phone Mount Holder Head Standard Screw Adapter Rotatable Digtal Camera Bracket Selfie…,https://www.amazon.com/AILUN-Rotatable-Adjustable-Compatible-Camcorder/dp/B072KNBV21/ref=pd_bxgy_2/146-7272643-6189729?_encoding=UTF8&pd_rd_i=B072KNBV21&pd_rd_r=4f28c1ac-22eb-49c6-8763-45a01b3bbc00&pd_rd_w=Y6Bde&pd_rd_wg=gBPMm&pf_rd_p=f325d01c-4658-4593-be83-3e12ca663f0e&pf_rd_r=76S0V9RDTTYBYK1E6RJJ&psc=1&refRID=76S0V9RDTTYBYK1E6RJJ
2082,B088FK38Z9,"FULAIM MX11 Wireless Lavalier Microphone System for iPhone DSLR Camera Android Cell Phones, UHF 20-Channel Wireless Lapel Microphone System for Professional Video Recording, Interview and Vlog - 1TX",,
2083,B000DZH9H4,Sony 75-300mm f/4.5-5.6 Compact Super Telephoto Zoom Lens for Sony Alpha Digital SLR Camera,,
2085,B08F55R6JT,"MIRFAK N2 On-Camera Microphone for DSLR, Mobile Phone, Camcorders, Recorders, PC,Directional Condenser Microphone, Cardioid Pattern【Free One-Year Warranty】",Insta360 ONE R Mic Adapter,https://www.amazon.com/Insta360-ONE-R-Mic-Adapter/dp/B084PZZB24/ref=pd_bxgy_2/137-1978193-8194743?_encoding=UTF8&pd_rd_i=B084PZZB24&pd_rd_r=eb21919c-8e40-469b-9ea2-92dbdd1cd50e&pd_rd_w=uJ4gn&pd_rd_wg=XJW6G&pf_rd_p=f325d01c-4658-4593-be83-3e12ca663f0e&pf_rd_r=R67R1PDYCBTNT40Z5K5C&psc=1&refRID=R67R1PDYCBTNT40Z5K5C
2086,B08JJ4MHWL,Tripod Center Column Extension Extender Telescopic 2 Section Pole Rod for Photo Studio Monopod Camera DSLR,,
2087,B083FDJZ2M,"Compact Smart Cell Phone Shotgun Microphone, Camera Video Mic for iPhone, Android Phone, GoPro Hero, DJI Osmo, DSLR, Video Camera on Vlogging/Wedding/Interview/Podcasting/Facebook Live/Run-n-gun Shoot",,
2088,B01LW2WQF2,InTePro Camera Strap with Blue map Design. World map Shoulder Camera Straps. Blue and White Camera Strap DSLR & SLR. Camera Accessories. Handmade Crafts by InTePro,,
2089,B07QXHLZ5H,"ENEGON LED Video Light Panel(Bi-Color 416 LED Beads) with 4000mAh Rechargeable Battery, Charger, Tripod,Hot Shoe,4 Color Filters for Canon,Panasonic,Nikon DSLR Cameras/Camcorder, CRI95 +, 3200K-5600K",,
2090,B081NDLH4G,STSEETOP Camera Lens Hood Collapsible Reversible Filter Thread Rubber Digital Lens Hood DSLR Lens Cap Shade (for 70-90mm Lens),"Lenskirt Anti-Reflection Portable, Flexible Lens Hood - Fits Any Lens",https://www.amazon.com/Lenskirt-Anti-Reflection-Portable-Flexible-Lens/dp/B005LAW7W8/ref=pd_bxgy_2/147-1381762-6047760?_encoding=UTF8&pd_rd_i=B005LAW7W8&pd_rd_r=922c9ce2-58c2-45f8-9915-0f088612775a&pd_rd_w=41zMm&pd_rd_wg=0MIAY&pf_rd_p=f325d01c-4658-4593-be83-3e12ca663f0e&pf_rd_r=NHA8B84A3ZDVF9W9VN52&psc=1&refRID=NHA8B84A3ZDVF9W9VN52
2091,B00403MGLO,Nikon D3100 Digital SLR Camera Body (Kit Box) No Lens Included - International Version (No Warranty),,
2092,B00YUQBOKK,"TOAZOE Professional Aluminum Alloy Quick Shoe Plate Adapter with 1/4 3/8 inches Screw for DSLR Camera Camcorder Tripod Monopod,Compatible with Manfrotto 501HDV 503HDV 701HDV 577/519/561/Q5",,
2093,B00D56353K,GODOX TT520 Universal Hot Shoe Flash Speedlite for DSLR Cameras Canon Nikon Pentax Olympus,,
2095,B0195ITK62,"Vidpro XM-AD5 Mini Pre-Amp Smart Mixer with Dual Condenser Microphones - Designed for DSLR’s, Video Cameras and SmartPhones",,
2096,B018I844Z2,"Neewer Rubber-Coated Metal Camera Lens Filter Remover Wrench Set Kit(Package of Two), Fit 58mm,62mm Lens Thread for Canon,Nikon,Sony,Pentax,Fujifilm,Olympus,Panasonic and Other DSLR Cameras","Neewer Rubber-Coated Metal Camera Lens Filter Remover Wrench Set Kit(Package of Two), Fit 49mm,52mm…",https://www.amazon.com/Neewer-Rubber-coated-Remover-Fujifilm-Panasonic/dp/B018I84358/ref=pd_bxgy_2/131-3542960-7923347?_encoding=UTF8&pd_rd_i=B018I84358&pd_rd_r=157f7d4e-074c-4d1f-a008-8e8b953c71e2&pd_rd_w=RY5iL&pd_rd_wg=gSCzD&pf_rd_p=f325d01c-4658-4593-be83-3e12ca663f0e&pf_rd_r=3MBEZQ7B71FV3B9HTK22&psc=1&refRID=3MBEZQ7B71FV3B9HTK22
2097,B01LZYARNF,Foto&Tech 90in(2.3M) Stretch/23in Coiled HEAVY WEIGHT LOCKING 3.5mm to Male Flash PC Sync Cable with Screw Lock Compatible with PocketWizard Plus III/Plus II&Nikon Canon Most DSLR Camera Flash Trigger,Pixel e-TTL Flash Hot Shoe Adapter with Extra PC Sync Port for Canon DSLRs and Flashguns,https://www.amazon.com/Pixel-Flash-Adapter-Extra-Flashguns/dp/B00554PCDG/ref=pd_bxgy_2/141-8890821-0876652?_encoding=UTF8&pd_rd_i=B00554PCDG&pd_rd_r=88990471-02f7-43af-a0f1-b373bae1f6b5&pd_rd_w=37YQs&pd_rd_wg=ZaVDV&pf_rd_p=f325d01c-4658-4593-be83-3e12ca663f0e&pf_rd_r=E18M4YHWJ3FX94GZ13QN&psc=1&refRID=E18M4YHWJ3FX94GZ13QN
2098,B07TT92T3B,DSLR Digital Camera Camcorder Lens Tool Rubber Repair Removal 9pcs Kit Contact Lens Remover Ring 43mm 49mm 52mm 55mm 58mm 62mm 67mm 72mm 77mm 82mm Universal Openning Repairing Accessories YN50MM F1.8,Andoer DSLR Camera Tool Set 3 Tips Lens Repair Set 6 Screws and 2 Hexagon Wrench for Canon Nikon…,https://www.amazon.com/Andoer-Professional-Tips10-100mm-Hexagon-Olympus/dp/B00QRPWCN0/ref=pd_bxgy_2/132-4125880-6737410?_encoding=UTF8&pd_rd_i=B00QRPWCN0&pd_rd_r=b847e1eb-dbf7-47e0-b944-316d611ea2f1&pd_rd_w=kXZcj&pd_rd_wg=YT4rX&pf_rd_p=f325d01c-4658-4593-be83-3e12ca663f0e&pf_rd_r=6TENQD8WCMZTK33AQFMT&psc=1&refRID=6TENQD8WCMZTK33AQFMT
2099,B08TBRHZQB,VSGO V-S01E Micro Four Thirds 4/3 Sensor Cleaning Swabs 12pcs for DSLR Cameras,,
2100,B07FP8793L,CEXO ACK-E10 AC Power Adapter Charging Kit for Canon DSLR Camera EOS 1100D 1200D X50T3,,
2101,B007QUG3XA,Focus Pyramid AutoFocus Lens Calibration Tool Focusing Target & Test Chart for Micro AF Fine Tuning Adjustment & Alignment Perfect for all DSLR Cameras Canon Nikon Sony Panasonic Olympus FujiFilm,,
