,ASIN,name,freq_bought,freq_bought_link
3060,B00SGY5M28,VONOTO DSLR Camera Hard Plastic Waist Belt Buckle Button - Camera Hanger Belt Clip Holster Holder Fast Loading rig for Canon 5d2 Nikon d7000 etc -Black,Andoer Aluminium -Alloy Camera Waist Belt Mount Button Buckle Hanger for DSLR Camera Waistband Belt…,https://www.amazon.com/Andoer-Aluminium-Alloy-Camera-Waistband/dp/B00REG9UOK/ref=pd_bxgy_2/141-3726618-0079705?_encoding=UTF8&pd_rd_i=B00REG9UOK&pd_rd_r=f8510b37-ee3d-4b9c-84bf-3df3bf11cfcb&pd_rd_w=a2p5F&pd_rd_wg=OZ533&pf_rd_p=f325d01c-4658-4593-be83-3e12ca663f0e&pf_rd_r=DD0NFHC3T2P6WBES1BE3&psc=1&refRID=DD0NFHC3T2P6WBES1BE3
3061,B07DNB1X2T,PIXEL Multifunction Battery Grip BG-E21 for Canon EOS 6D Mark II Digital SLR Camera Batteries E21 LP-E6/LP-E6N (Replacement for Canon BG-E21),,
3062,B0045T45L2,Dicapac USA Inc. Waterproof Case for Single-Lens Reflex Camera - Carrying Case - Retail Packaging - Dark Brown,DiCAPac WP-S10 Pro DSLR Camera Series Waterproof Case,https://www.amazon.com/DiCAPac-WP-S10-DSLR-Camera-Waterproof/dp/B00169HXW2/ref=pd_bxgy_2/137-4058918-9229453?_encoding=UTF8&pd_rd_i=B00169HXW2&pd_rd_r=fc93dc5d-9013-4025-bb26-9dd01394f4aa&pd_rd_w=IH6BO&pd_rd_wg=ut1yN&pf_rd_p=f325d01c-4658-4593-be83-3e12ca663f0e&pf_rd_r=XW0K9BZE6KQPDAH8YBXJ&psc=1&refRID=XW0K9BZE6KQPDAH8YBXJ
3063,B07XHGPKJ1,"Low Profile Ball Head All Metal Tripod Ball Head INNOREL Panoramic CNC Ball Heads Camera Mount with Two 1/4"" Quick Release Plates for Tripod, DSLR, Camcorder, Telescope，Max Load 66lbs/30kg",,
3064,B082B1QFT9,SAIREN Vlog Video On Camera Microphone Cardioid Directional Shotgun Mic Plug and Use Broadcast Mic w High Sensitivity for Canon Nikon Panasonic Sony A7 III etc DSLR/Camera for iPhone 11 Pro Recording,,
3065,B07WLK11BK,"Andoer Camera Microphone, Video Recording Microphone with Earphone Monitor Hole and Deadcat Windscreen, Mic for iPhone Android Smartphones Canon/Nikon/Sony DSLR Camera Camcorder",,
3066,B0781QP3MF,Peak Design Ash Slide Camera Strap SL-AS-3 (Ash),Peak Design Cuff Camera Wrist Strap Ash (CF-AS-3),https://www.amazon.com/Peak-Design-CF-AS-3-Aluminium-Leather/dp/B0741FV1RL/ref=pd_bxgy_2/146-5736433-4754509?_encoding=UTF8&pd_rd_i=B0741FV1RL&pd_rd_r=ccf94274-c218-443b-9524-c338851dbc94&pd_rd_w=NSqdT&pd_rd_wg=rXBHf&pf_rd_p=f325d01c-4658-4593-be83-3e12ca663f0e&pf_rd_r=MQYR5NRKZYW7S56VMBVB&psc=1&refRID=MQYR5NRKZYW7S56VMBVB
3067,B08HDDJPDT,"Camera Microphone, YouTube Video Microphone for DSLR Camera Canon Nikon Panasonic Sony Gopro Vlogging Interview",,
3068,B07W66QFPR,"10"" Selfie Ring Light with Tripod Stand & Phone Holder for Live Stream/Makeup, Dimmable Led Camera Beauty Ringlight for YouTube TikTok/Photography Compatible with Cell Phone(Upgraded)","Booty 3 Resistance Bands for Legs and Butt Set, Exercise Bands Fitness Bands - Video Workout…",https://www.amazon.com/Resistance-Exercise-Strength-Beginner-Professional/dp/B07TZPVXMH/ref=pd_bxgy_2/141-2289980-2706429?_encoding=UTF8&pd_rd_i=B07TZPVXMH&pd_rd_r=5b5d255f-d870-4963-b86c-dd505a0cc5c5&pd_rd_w=fHodk&pd_rd_wg=viA0L&pf_rd_p=f325d01c-4658-4593-be83-3e12ca663f0e&pf_rd_r=QWNTRHGCQF1EGJVKXSCE&psc=1&refRID=QWNTRHGCQF1EGJVKXSCE
3070,B08GPQF1CP,NICEYRIG NATO Clamp Top Handle Quick Release DSLR Camera Ergonomic Handle Grip,,
3071,B083NYG611,Camera Stabilizers ORDRO Foldable Camera Holder Stabilizing Handheld Stabilizer Handle Grip with Accessory Mount for Camera Camcorder DSLR DV Video Camcorders AC3/AC5/AZ50/Z20/AE8/AC7,"SanDisk 128GB Ultra SDXC UHS-I Memory Card - 100MB/s, C10, U1, Full HD, SD Card - SDSDUNR-128G-GN6IN",https://www.amazon.com/SanDisk-128GB-Ultra-UHS-I-Memory/dp/B07YFGG1SD/ref=pd_bxgy_2/134-1256731-5659416?_encoding=UTF8&pd_rd_i=B07YFGG1SD&pd_rd_r=09f3a995-9417-450a-8e57-2bb0ea0549c6&pd_rd_w=B6Hp6&pd_rd_wg=Mqva5&pf_rd_p=f325d01c-4658-4593-be83-3e12ca663f0e&pf_rd_r=9C9YQ3JSEK8XB61AZMD9&psc=1&refRID=9C9YQ3JSEK8XB61AZMD9
3072,B085KZS6TV,"Camera Mini Tripod Ball Head, Metal Tripod Mount Ballhead 360° Pan 90° Tilt Tripod Mount with 1/4"" Screw for DSLR/SLR Camera Compatible with Canon/Nikon/Video Camcorder/Smartphone/iPhone",,
3073,B074DT3LWH,"Yidoblo 96W 18"" LED Ring Light Kit FE-480II Black Photo Studio Video Portrait Selfie Makeup Youtub Lighting Bicolor with Remote, Phone/Camera Holder, Mirror, Light Stand, Batteries&Chargers, Carry Bag",,
3074,B07S8QDSG3,"VBESTLIFE Waterproof Housing for Sony A6000/A6300/A6500, 60m 195ft Underwater Diving DSLR Camera Full Protection Waterproof Protective Case Shell Cover Protector Cage Water Resistant Housing",,
3075,B07ZBMJ417,Canon PowerShot ELPH 360 HS Digital Camera Balck + 64GB SD Memory Card (Silver),,
3076,B010HKEF76,Neewer Vertical Battery Grip Replacement for MB-D15 Works with EN-EL15 Battery or 6 Pieces AA Batteries for Nikon D7100 D7200 Digital SLR Camera,"EN-EL15 EN EL15a RAVPower Battery Charger Set Compatible with Nikon d750, d7200, d7500, d850, d610…",https://www.amazon.com/EN-EL15-RAVPower-Battery-Compatible-Batteries/dp/B01JG6QWUA/ref=pd_bxgy_2/145-8363010-0038966?_encoding=UTF8&pd_rd_i=B01JG6QWUA&pd_rd_r=6af1ce61-2963-4843-bf65-cc4270d91591&pd_rd_w=o2yVz&pd_rd_wg=9ns9E&pf_rd_p=f325d01c-4658-4593-be83-3e12ca663f0e&pf_rd_r=SSAWXEKEMNZXMFD2D4BT&psc=1&refRID=SSAWXEKEMNZXMFD2D4BT
3077,B08L4MPRTT,FEICHAO 2Pcs Professional 3/8 1/4 Hot Shoe Adapter Tripod Mount Screw to Flash for DSLR Camera (1/4 Shoe),,
3078,B01A60SXSO,"Panasonic Full HD Video Camera Camcorder HC-V180K, 50X Optical Zoom, 1/5.8-Inch BSI Sensor, Touch Enabled 2.7-Inch LCD Display (Black)",,
3079,B07BKNSH7R,Shimoda Carry-On Roller V1 for DSLR and Mirrorless Cameras - Blue Nights (520-021),Shimoda Core Unit Medium DSLR V1 (520-092),https://www.amazon.com/Shimoda-Explore-Core-Unit-Medium/dp/B07BKMXYBN/ref=pd_bxgy_2/145-4137976-3282637?_encoding=UTF8&pd_rd_i=B07BKMXYBN&pd_rd_r=18d95e52-fd32-4379-b905-e8b466945259&pd_rd_w=Bo3nV&pd_rd_wg=ItxP8&pf_rd_p=f325d01c-4658-4593-be83-3e12ca663f0e&pf_rd_r=RT6YATPR2Y88MQXCXQCJ&psc=1&refRID=RT6YATPR2Y88MQXCXQCJ
3080,B08F1FMW7L,Hollyland Mars 300 PRO HDMI Loopout Wireless Transmitter and Receiver Standard Version for SLR/MILC Camera with 300ft Long Range 0.08S Low Latency 1080P HD Video Transmission System (Standard),,
3082,B08NZQ69HX,"Tikysky Camera Microphone M-3,External Video Microphone for Phone iPhone Camera with Shock Mount Windproof Windscreen,DSLR Mic for Canon Nikon Sony Panasonic Fuji Interview",,
3084,B07TBMCRD8,"Selfie Ring Light with Tripod Stand - Dimmable Makeup Ring Light Led Camera Ringlight with Tripod and Phone Holder for Live Stream/Makeup/YouTube Video, Compatible for iPhone Android, Remote(Upgraded)",,
3085,B07MBG3PP8,"Boling P1 RGB Led Video Light 2500k-8500k Mini Pocket Size On Camera Light with 9 Applicable Situation, 360° Adjustable Support System with Built in Battery",Amlong Crystal 6 inch Optical Glass Triangular Prism for Teaching Light Spectrum Physics and Photo…,https://www.amazon.com/Amlong-Crystal-Triangular-Teaching-Photography/dp/B00FHFV9AI/ref=pd_bxgy_2/145-3841012-8199456?_encoding=UTF8&pd_rd_i=B00FHFV9AI&pd_rd_r=1a5a1a64-b392-4b96-ba3c-11d74a0841a8&pd_rd_w=ogpoz&pd_rd_wg=Upak8&pf_rd_p=f325d01c-4658-4593-be83-3e12ca663f0e&pf_rd_r=76QRE0EW1XWH0Y0AWX5K&psc=1&refRID=76QRE0EW1XWH0Y0AWX5K
3087,B08FXCW9PM,"Video Microphone, External Vlogging Microphone on Camera, Dual Headed Recording Microphone for DSLR/Canon/Nikon/Sony Camera",,
3088,B004SOM2U0,Minolta Maxxum AF 35-70mm f/4 for Minolta Maxxum Dynax SLR/DSLR cameras and Sony Alpha A-mount DSLR cameras,,
3089,B0035JD0DW,Fujifilm FinePix S1800 12.2 MP Digital Camera with 18x Wide Angle Optical Dual Image Stabilized Zoom and 3-Inch LCD,,
3090,B005EQS47Q,"Bower LCD Timer and Remote Shutter Release for Sony A100/A200/A350/A700/A900/7D/5D/Dynax 9,7,5,4,3/Dynax 807,800,700,600,505SI Digital SLR Cameras (RCLS1R)",,
3091,B073433TW8,"MegaGear MG1258 Ever Ready Leather Camera Case compatible with Panasonic Lumix DC-ZS80, DC-ZS70, DC-TZ95, DC-TZ90 - Black","Panasonic LUMIX DC-ZS70K, 20.3 Megapixel, 4K Digital Camera, Touch Enabled 3-Inch 180 Degree Flip…",https://www.amazon.com/Panasonic-Digital-DC-ZS70K-Megapixel-VARIO-ELMAR/dp/B071R6JRZZ/ref=pd_bxgy_2/140-9090501-2888909?_encoding=UTF8&pd_rd_i=B071R6JRZZ&pd_rd_r=2d91d395-bd7e-4a81-bb80-76724ec35703&pd_rd_w=SYmTd&pd_rd_wg=YQ8XZ&pf_rd_p=f325d01c-4658-4593-be83-3e12ca663f0e&pf_rd_r=RPABACYE85ZCE0SXE7VK&psc=1&refRID=RPABACYE85ZCE0SXE7VK
3092,B00FP6BAA8,Pentax HD Pentax-DA 55-300mm f/4-5.8 ED WR Lens,,
3093,B083989PFJ,Crab Clamp Fixed Clip Portable Travel Photography Bracket Tripod Support Stand for Vlog Video Canon Sony Nikon Panasonic DJI Action Gopro Insta360 DSLR Accessories with Ballhead Arca-Swiss QR Plate,,
3094,B07YBCMXJJ,"Video Camera Camcorder, Digital YouTube Vlogging Camera FHD 1080P 30FPS 24MP 16X Digital Zoom 3 Inch Touch Screen Video Recorder with Remote Control and Tripod, 2 Batteries","SanDisk 128GB Ultra SDXC UHS-I Memory Card - 100MB/s, C10, U1, Full HD, SD Card - SDSDUNR-128G-GN6IN",https://www.amazon.com/SanDisk-128GB-Ultra-UHS-I-Memory/dp/B07YFGG1SD/ref=pd_bxgy_2/140-0119531-0317846?_encoding=UTF8&pd_rd_i=B07YFGG1SD&pd_rd_r=3c4d8d30-52e0-4d99-8ac6-03f461be0c64&pd_rd_w=mzOwW&pd_rd_wg=RnuVa&pf_rd_p=f325d01c-4658-4593-be83-3e12ca663f0e&pf_rd_r=5C5AQ34DB1XMG8MGFY40&psc=1&refRID=5C5AQ34DB1XMG8MGFY40
3096,B07PT3DF52,Shenligod Battery Door Cover Lid Cap Replacement for Nikon D5100 DSLR Camera (2PCS),,
3097,B01NCNWQFC,"Pixel Wireless remote Timer Shutter Release Remote Control TW-283/S1 FSK 2.4GHz LCD for Sony A560, A580, A290, A390, A450, A33, A500, A550, A850, A900, A350, A300,A200, A700",,
3098,B0013PHTBO,Sony 24 -70mm f/2.8 Carl Zeiss Vario Sonnar T Zoom Lens for Sony Alpha Digital SLR Cameras - International Version (No Warranty),,
3099,B0821FHSMX,QKOO 3pcs ND Filter Set ND2 ND4 ND8 + 3pcs Gradual Neutral Density ND Filter G.ND2 G.ND4 G.ND8 + 9pcs Ring Adapter (49/52/55/58/62/67/72/77/82mm) + Filter Holder + Filter Case for DSLR SLR Camera,,
3101,B07P5V8Q1K,Vizelex ND Throttle Lens Mount Adapter Compatible with Canon EOS EF (NOT EF-S) DSLR Lens to Nikon Z-Mount Mirrorless Camera Body with Built-in Variable ND Filter (1 to 8 Stops),,
3102,B07Q47QQDT,ROKINON 14mm F2.8 Ultra Wide Angle Weather Sealed Lens for Canon R Mirrorless Cameras,,
3103,B07DLH3K9B,"Zeikos ZELP3 Lens Case Size Thick Protective Neoprene Pouch for DSLR Camera Lens (CanonNikonPentaxSonyOlympusPanasonic) Comes with a Miracle Microfiber Cloth, Large",,
3104,B08LBMSZ72,"USKEYVISION Universal Directional Video Microphone for iPhone, Smartphone,Canon EOS,Sony Alpha,Nikon DSLR Camera,Camcorders, Laptops-Vlog Microphone,Shotgun Mic with Real Time Monitoring (UVM-Pro)","Hohem iSteady Mobile+, The 3-Axis Gimbal Stabilizer Compatible with iPhone 12 Pro 11 XS & Android…",https://www.amazon.com/Hohem-Smartphone-Stabilizer-iSteady-Mobile/dp/B07GDBT8GN/ref=pd_bxgy_2/144-3744392-4778929?_encoding=UTF8&pd_rd_i=B07GDBT8GN&pd_rd_r=d4f27856-ef0a-466e-945a-e237127946f7&pd_rd_w=9VZhV&pd_rd_wg=TfNZ9&pf_rd_p=f325d01c-4658-4593-be83-3e12ca663f0e&pf_rd_r=SAN8DY1TJRJQBDPV90Y5&psc=1&refRID=SAN8DY1TJRJQBDPV90Y5
3107,B000JE960M,Sony SAL-35F14G 35mm f/1.4 Aspherical G Series Standard Lens for Sony Alpha Digital SLR Camera,,
3108,B07VD4X6G8,"Camera Tripod 60 Inch, Patented Built-in Mobile Phone Holder Tripod with Carry Bag, Max Load up to 22 LB, 1/4"" Mounting Screw, Stable Travel Tripod for DSLR, DV Video Camcorder, Phone Camera Vlog",Colorful Happy Birthday Banner Birthday Decorations Party Supplies With Honeycomb Balls Swirls…,https://www.amazon.com/Colorful-Birthday-Decorations-Supplies-Honeycomb/dp/B0893HM84V/ref=pd_bxgy_2/145-0256067-7563640?_encoding=UTF8&pd_rd_i=B0893HM84V&pd_rd_r=e8d4d0ce-29b9-4f1e-a490-c6ee48ced550&pd_rd_w=DFSvH&pd_rd_wg=PVTEg&pf_rd_p=f325d01c-4658-4593-be83-3e12ca663f0e&pf_rd_r=Z3QBMQDC7X0VGJKWETX6&psc=1&refRID=Z3QBMQDC7X0VGJKWETX6
3109,B01N49JVWJ,PhotoTrust Battery Door Cover Lid Cap Replacement Repair Part Compatible with Nikon D3100 DSLR Digital Camera,2 Pack JJC 52mm Front Lens Cap Cover with Elastic Cap Keeper for Nikon D3000 D3100 D3200 D3300 D5000…,https://www.amazon.com/2-Pack-JJC-Elastic-Keeper-18-55mm/dp/B06XHY3C22/ref=pd_bxgy_2/145-5171796-4889506?_encoding=UTF8&pd_rd_i=B06XHY3C22&pd_rd_r=f6d87b6a-b117-4ed0-b490-12160ed89df2&pd_rd_w=0PqPj&pd_rd_wg=LY0CW&pf_rd_p=f325d01c-4658-4593-be83-3e12ca663f0e&pf_rd_r=2YHXVK21BQ17RFMVMZRK&psc=1&refRID=2YHXVK21BQ17RFMVMZRK
3110,B08DYBW1HS,"Manfrotto MVG220, Portable 3-Axis Professional Gimbal Stabiliser for Mirrorless and Reflex Cameras, Flexible, Holds up to 4.85 lbs, Perfect for Photographers, Vloggers and Bloggers",,
3111,B084P59NGD,"Photo4less Deluxe DSLR Camera Case Shoulder Bag for Canon, Nikon & Sony",,
3112,B08N5STTNN,"Phone Tripod, Portable and with and Universal Clip, 360°Rotation Flexible Travel Tripod for Smartphone, DSLR CameraCompatible with iPhone/Android/Camera, Cell Video Recording",,
3113,B00DBL0NLQ,"Sigma 18-35mm F1.8 Art DC HSM Lens for Canon, Black (210101)",,
3114,B00MMM5XJW,Ikelite 6812.81 Underwater Camera Housing for Nikon D-810 DSLR Camera,,
3115,B08JCRMBKJ,"Phone Tripod, Portable Flexible Tripod Cell Phone Camera Tripod with Wireless Remote Compatible with iPhone/Android/DSLR/GoPro, iPhone Tripod Stand for Live Streaming Selfie YouTube Video Recording","UBeesize 67'' Phone Tripod Stand & Selfie Stick Tripod, All in One Professional Cell Phone Tripod…",https://www.amazon.com/UBeesize-Professional-Cellphone-Bluetooth-Compatible/dp/B08D6KM95D/ref=pd_bxgy_2/140-6496192-3397922?_encoding=UTF8&pd_rd_i=B08D6KM95D&pd_rd_r=5dde427c-b7e7-4e9e-9800-601ae98e5669&pd_rd_w=SnBFY&pd_rd_wg=1QWNZ&pf_rd_p=f325d01c-4658-4593-be83-3e12ca663f0e&pf_rd_r=G9PHNQZ0XJAB2W8459ZW&psc=1&refRID=G9PHNQZ0XJAB2W8459ZW
3116,B086MR9VKW,"Copy Stand Tripod for Digital SLR Camera, Aluminium Alloy Photo Studio Copy Stand Photography High Shooting Bracket Suitable for Digital Camera Multi-Angle Shooting",,
3117,B08G3LT9VR,"OJelay Ultra-Bright Professional LED On-Camera Light Panel, 192 LED Bulbs with Adjustable Color Temperature 3200K-5600K and Brightness, for DSLR Camera, Video and Camcorder,(Fit Canon Sony Nikon)",,
3118,B08S48BJJS,"Yisau Camera Case for Canon EOS Rebel T8i, Canon T8i Digital Camera Sleeve 850D Accessories, Anti-Scratch Soft DSLR Sleeve with Rebel T8i Screen Protector (Red)",,
3119,B0824PKKZP,"DEVMO YT-228 Mini Tripod Table Top Stand and Phone Mount, Compact, Travel Ready, Compatible with Gopro, Smartphones, Compact Cameras, DSLRs, and Selfie Sticks",,
3120,B01HQ2H6OW,"Mini HDMI to HDMI Cable, CableCreation 0.5ft Mini-HDMI Male to HDMI Female Adapter, Support 1080P Full HD, 3D, for Camera, Camcorder, Graphics Card, Laptop,Tablet, HDTV,Projector, 0.15M, Black",,
3121,B0716D8BDY,EN-EL14 EN EL14A RAVPower Battery Charger and 2-Pack Rechargeable Li-ion Batteries Compatible with Nikon D5600 D3300 D3500 D5100 D5500 D3100 D3200 D5200 D5300 Coolpix P7000 P7100 P7200 P7700 P7800,"SanDisk 128GB Extreme SDXC UHS-I Card - C10, U3, V30, 4K UHD, SD Card - SDSDXV5-128G-GNCIN",/SanDisk-128GB-Extreme-UHS-I-SDSDXV5-128G-GNCIN/dp/B07H48412Q/ref=pd_bxgy_2/147-5971026-2244259?_encoding=UTF8&pd_rd_i=B07H48412Q&pd_rd_r=266963ef-7a0b-4353-b719-13f2c09bf678&pd_rd_w=VO8Gb&pd_rd_wg=alI9Y&pf_rd_p=f325d01c-4658-4593-be83-3e12ca663f0e&pf_rd_r=T5RXDMT50Y3BYCG1TPKS&psc=1&refRID=T5RXDMT50Y3BYCG1TPKS
3122,B08CSHSXKW,Video Camera with Microphone YouTube Camera for Vlogging 4K Webcam 30FPS 16X Digital Zoom Recorder Video Cameras 3.0 Inch Touch Screen Cameras for Photography and Video with Two Batteries,2.7K Video Camera for YouTube Vlogging Digital Camera Camcorder with Microphone 30MP 3.0 Inch KOMERY…,https://www.amazon.com/Vlogging-Camcorder-Microphone-KOMERY-Rotation/dp/B08BRXTT6D/ref=pd_bxgy_2/139-7481152-7569258?_encoding=UTF8&pd_rd_i=B08BRXTT6D&pd_rd_r=766c32d6-d131-4260-aef5-7cefe240aef9&pd_rd_w=BCgo4&pd_rd_wg=F33Ry&pf_rd_p=f325d01c-4658-4593-be83-3e12ca663f0e&pf_rd_r=ZJNA51M8Q087YVJPJQ9M&psc=1&refRID=ZJNA51M8Q087YVJPJQ9M
3123,B08CRWHJJC,"Anti-Scratch Wrist Strap, Soft Comfortable Cotton Core Cord Lanyard for DSLR Camera (Black)",,
3124,B07Y1W2KLV,"Pixel M80 Video Microphone with Shock Mount, Deadcat Windscreen and Audio Cables, Compatible with DSLR, Camcorder, iPhone, Android Smartphone, Suitable for Vlogging, Videography, Live Streaming, etc.",,
3125,B0076396OA,Pentax K-01 16MP APS-C CMOS Mirrorless Digital Camera [Body] (Black),,
3126,B074FRWDFN,"Alstar T-Ring and M42 to 1.25"" Telescope Adapter (T-Mount) for 42mm Pentax-k SLR/DSLR Telescope Cameras.(for Camera K-x, K-r, K-01, K-30, K20D, K200D, K2000, K1000, K100D Super, K110D, Etc).",,
3127,B07GZYMS2Z,"43mm Lens Cap [3 Pack], HonesThing 43mm Camera Lens Protection Cover with 3 Lens Cap Keepers compatible with Canon, Nikon, Sony and any other DSLR Camera",,
3128,B08M8XGM79,HDMI to VGA Adapter with Audio Cable Baily 1080P HDMI Male to VGA Female Adapter Converter with 3.5mm Audio Cable and Micro USB Charging Cord for DVD Player Tablet PC Digital/SLR Camera (1 Pack),,
3129,B085QGMXHV,"Pomya Telephoto Lens, Professional 500mm F6.3 Telephoto Lens Fixed Focus for DSLR SLR Cameras for Canon for Nikon for Sony for Pentax(T2-EOS)",,
3130,B08695XMLF,Kayulin Super Crab Clamp with Locating pin for DSLR Camera Studio,,
3131,B07WHLRDSM,Digital Camera Vlogging Camera with YouTube 24MP 2.7k Full HD Camera with Flip Screen 180 Degree Rotation,,
3132,B07NWR1FS5,"32GB SD Memory Card | SD Card Compatible with Panasonic Lumix Series DMC-GX85, DMC-GM5, DMC-GF7, DMC-G7, DMC-GX8, DMC-GF6, DMC-GX7, DMC-GM1, DMC-GF5, DMC-G5, DMC-GH3 DSLR Camera | 32 GB",,
3133,B08DF81DLY,"U-70 Ball Head Tripod Mount with Rotatable Cold Shoe Mic/Light Mount, Arca-Swiss Plate Compatible with V3 Clip, Angle Shots Adjustable Panoramic Photography Ballhead Setup Video Shooting",,
3134,B01M8NWKUD,Movo VS1000PRO Telescoping Video Stabilizer System with Micro Balancing and Quick Release Platform - for DSLR Cameras and Camcorders up to 8.8 LBS,,
3136,B00J5GDSFY,HQRP AC Adapter Works with Pentax K-AC50 39365 39364 K5 K7 K10D K20D K645 Digital SLR Camera Power Supply Cord K-5 K-7 K-10D K-20D K-645 + Euro Plug Adapter,,
3137,B08CSFXGN6,"LED Camera Video Light Panel Light,Mini 49 Light Dimmable Portable Vlog Lamp Fits for Canon Nikon Sony Pentax Samsng DSLR Cameras for DJI OSMO Pocket Mobile 3 2 Zhiyun Smooth 4 Volgging",,
3138,B07Y85Z7ML,"GVM RGB Camera Light, 2 Packs Led Video Light Panel with APP Control, LED Camera Light Full Color 8 Common Light Effects, CRI≥97 3200-5600K Video Lighting Kit for YouTube Vlog Photography",,
3139,B07P8K3YTD,"Comica CVM-V30 LITE B Universal Camera Microphone Directional Condenser Shotgun Video Microphone for Canon, Nikon, Fuji, Sony, Panasonic, Olympus DSLR Cameras, iPhone Android Smartphones etc.",Onvian 3.5mm Female to 5 Pin Mini USB Male Microphone Adapter Cable,https://www.amazon.com/Onvian-3-5mm-Female-Microphone-Adapter/dp/B01KHVEUX4/ref=pd_bxgy_2/145-3143051-3112555?_encoding=UTF8&pd_rd_i=B01KHVEUX4&pd_rd_r=e6a83bf7-8645-4299-b4fe-0ae8c788e9bb&pd_rd_w=cnbOJ&pd_rd_wg=E11MN&pf_rd_p=f325d01c-4658-4593-be83-3e12ca663f0e&pf_rd_r=GYFJCQW8X3TP78XPS0N6&psc=1&refRID=GYFJCQW8X3TP78XPS0N6
3140,B07M8HQQDY,"Hotec UHF Wireless Headset Microphone/Lavalier Lapel Mic with Bodypack Transmitter and Mini Rechargeable Receiver 1/4"" Output, for Live Performances, Support Phone",,
3142,B07K21YYFK,foto4easy Professional Rocket Cleaning Air Blower Duster for LCD Screen Keyboard Digital DSLR Camera Telescope Lens Filters,,
3143,,Vintage Leather DSLR Camera Case Messenger Crossbody Sling Bag Fit DSLR with 2 Lenses for Canon Sony Nikon Canon Olympus and So On,,
3144,B07FN57LDS,PowerShot SX620 HS Digital Camera (Black) + Deal-Expo Bundle.,SanDisk Ultra 64GB Class 10 SDXC UHS-I Memory Card up to 80MB/s (SDSDUNC-064G-GN6IN),https://www.amazon.com/SanDisk-Ultra-UHS-I-Memory-SDSDUNC-064G-GN6IN/dp/B0143IIP4W/ref=pd_bxgy_2/145-4011891-2090627?_encoding=UTF8&pd_rd_i=B0143IIP4W&pd_rd_r=9d3ffaa9-fcc0-4880-9b64-8680a3304067&pd_rd_w=HXwcA&pd_rd_wg=64pR6&pf_rd_p=f325d01c-4658-4593-be83-3e12ca663f0e&pf_rd_r=W3K8P5GEXKZY8WFSHGY0&psc=1&refRID=W3K8P5GEXKZY8WFSHGY0
3145,,"LED Camera Light,GVM RGB 7s Dimmable Ultra LED Light on Panel Digital Camera/SLR Camera /Camcorder Video Light with Built-in Battery,Charger,High Brightness,Multi-color and White Magnet Filters",,
3146,B08J8746RF,Canon Rebel SL3 Screen Protector for Canon EOS Rebel SL3 DSLR Camera with Hot Shoe Cover Tempered Glass Film [3+1 Pack] 0.3mm 9H Hardness,,
3147,B07J565Z35,LHIABNN Camera Lens Cap Buckle Anti Lost Button Holder Keeper for Cameras Canon Nikon Sony Pentax Sigma DSLR/SLR/Evil (Anti-Lost Cap/ 43x46x55mm),,
3148,B002JCSV8U,"Nikon 70-200mm f/2.8G ED VR II AF-S Nikkor Zoom Lens For Nikon Digital SLR Cameras (New, White box)",,
3149,,"Hamanee 3.5mm TRRS (Female) Microphone Adapter Cable to 3.5mm TRS (Male) for DSLR Camera, PC, Laptop, and iOS, Android, Samsung, Windows Smartphone Recorders",,
3150,B009YYFK5S,Think Tank Photo Glass Limo Backpack (Black),,
3151,B00THKEKEQ,Nikon Coolpix L340 20.2 MP Digital Camera with 28x Optical Zoom and 3.0-Inch LCD (Black),,
3152,,DRRI D-Tap to XLR 4-pin Female Right Angle Power Cable for DSLR Camcorder/ARRI Camera Monitor (R4xlr-Dtap TTC),,
3153,B00GTRGVEW,MegaGear Single Shoulder Neoprene Neck Strap Belt For Camera SLR DSLR HotPink,,
3154,B07C5HB5LT,Screen Protector for Canon EOS Rebel T7 T6/ 1500D 1300D DSLR Camera [3 Pack] WH1916 Tempered Glass Anti-Bubble Anti-Fingerprint Anti-Dust Anti-Scrach,,
3156,B07X3HW28M,"Extension Rod Pole Bar SZ_ABTO Adjustable Selfie Stick for Gimbal Stabilizer Compatible with OSMO Mobile 3 2 Action Gopro Vlog Pocket Zhiyun Smooth 4 Q2 Moza Mini S Handheld Gimbal with 1/4"" Thread","SanDisk 128GB Extreme microSDXC UHS-I Memory Card with Adapter - C10, U3, V30, 4K, A2, Micro SD…",https://www.amazon.com/SanDisk-128GB-Extreme-microSD-Adapter/dp/B07FCMKK5X/ref=pd_bxgy_2/144-5032370-6243116?_encoding=UTF8&pd_rd_i=B07FCMKK5X&pd_rd_r=7dc9a63d-7001-4196-9731-5d950ccf74ec&pd_rd_w=gZ9zH&pd_rd_wg=DjNGI&pf_rd_p=f325d01c-4658-4593-be83-3e12ca663f0e&pf_rd_r=XDRH8HQ9WA6Z75H97NW4&psc=1&refRID=XDRH8HQ9WA6Z75H97NW4
3157,B08FMMMZ5K,"Wireless Lavalier Microphone,Comica BoomX-U1 48-Channel UHF Wireless Lapel Mic with 1 Transmitter and 1 Receiver,Lav Mic for Camera Camcorder Smartphone DSLR Interview Podcast Facebook YouTube Vlog",,
3158,B084B3Z8FX,Fujifilm X100V Digital Camera - Black,"SanDisk 128GB Extreme PRO SDXC UHS-I Card - C10, U3, V30, 4K UHD, SD Card - SDSDXXY-128G-GN4IN",/SanDisk-128GB-Extreme-UHS-I-SDSDXXY-128G-GN4IN/dp/B07H9DVLBB/ref=pd_bxgy_2/147-1476648-3356120?_encoding=UTF8&pd_rd_i=B07H9DVLBB&pd_rd_r=54d09e55-e39a-4587-baaa-9f15711caf94&pd_rd_w=mhRLO&pd_rd_wg=hlI7P&pf_rd_p=f325d01c-4658-4593-be83-3e12ca663f0e&pf_rd_r=1H7YFJ3ZQTE1W68EN3BA&psc=1&refRID=1H7YFJ3ZQTE1W68EN3BA
3159,B07NP5JV5K,"CBUS 15ft HDMI to Micro HDMI Cable for GoPro Hero, Canon EOS M50 M5 M6 M100, Panasonic LUMIX ZS200 G85 GX850 FZ80 ZS70 LX10 GX85 FZ300 G7 GX8 GX9 ZS100, Sony a6400 a6300 RX0 a9, a7 III, a7R III a7S II",,
3160,B086963PQ7,Kayulin Shooting Tripod with Mini Ball Head for for Camera Mobile Phone DSLR,,
3161,B00NP4AMHO,"Nicama Camera shoulder Neck Strap Retro Vintage VNS Soft Multi-color Belt for DSLR Canon Fuji Nikon Olympus Panasonic Pentax Fujifilm X100F X-T20 X-T2 X70 X-Pro2,Sony A6000 A630",,
3162,B01JZM68NQ,"Camera Strap Inspired by Native Americans. Black and Pink-red Southwestern Ethnic Camera Strap. DSLR/SLR Camera Strap. Durable, Light Weight and Well Padded Camera Strap. Code 00190",,
3163,B08N6MFR4K,"Selfie Stick Tripod, Extendable Phone Tripod Stand with Detachable Bluetooth Wireless Remote Shutter Compatible with iPhone, Android, DSLR, Action Camera, Gopro and More (White)",,
3165,B08M9TNLZT,"Bindpo Mic Audio Mixer, 2 Channel Universal Microphone Audio Adapter Mixer with Three Mounting Shoes,3.5mm Inputs,for DSLR Cameras",,
3167,B077GQ9F65,Alstar Metal T-Ring Adapter for N ikon DSLR/SLR (Fits All Ni kon DSLR/SLR Cameras),,
3169,B08PBNDWKQ,SUNWAYFOTO CQCP-01 Capture Camera Clip Cushion pad for DSLR Accessories,,
3170,B07NWC2KWS,"16GB SD Memory Card | SD Card Compatible with Canon EOS Series 1300D, 800, M10, 7D Mark II, M2, 750D, 760D, Kiss M, 5DS X DSLR Camera | 16 GB",,
3171,,"Neewer 4""x5""/10cmx13cm Universal Foldable Flash Light Diffuser Softbox for Canon Nikon Sony Sigma Olympus Minolta Sunpak DSLR Cameras, such as Canon 580EX 550EX 540EZ 430EX 420EX 380EX 430EZ Nikon SB-800 SB-600 SB-80DX SB28 SB26 SB25 SB24",,
3172,B01N1PZJXH,"OCTO MOUNT Handheld Stabilizer for iPhone 6 Plus, Galaxy Note, LG or Any Large Smartphone Device. Also Compatible with GoPro and DSLR Cameras",,
3173,B07T8FBZC2,"Neewer 2 Packs Dimmable 5600K USB LED Video Light with Adjustable Tripod Stand/Color Filters for Tabletop/Low Angle Shooting, Colorful LED Lighting, Product Portrait YouTube Video Photography",Neewer 6.5x9.8ft/2x3M Background Stand Backdrop Support System with 6x9ft/1.8x2.8M Muslin Backdrop…,https://www.amazon.com/Neewer-6-5x9-8ft-Background-Backdrop-Photography/dp/B07FTG3SKZ/ref=pd_bxgy_2/133-8893445-3259133?_encoding=UTF8&pd_rd_i=B07FTG3SKZ&pd_rd_r=c513fed8-f651-412f-8645-d65126ad589c&pd_rd_w=LOuaR&pd_rd_wg=xErN3&pf_rd_p=f325d01c-4658-4593-be83-3e12ca663f0e&pf_rd_r=J6XN04B3BB7JJF3R1E0G&psc=1&refRID=J6XN04B3BB7JJF3R1E0G
3174,B08831NVCQ,"Foto4easy Vertical Power Battery Grip for Sony A9II A7RIV A7IV A7M4 A7RM4 A7R4 DSLR Camera, Battery Holder for 2X NP-FZ100 Battery",,
3179,B08DP4NKGN,Sony NEW Alpha 7S III Full-frame Interchangeable Lens Mirrorless Camera,,
3180,B07HFMTT3T,"debous Screen Protector Compatible Canon Eos 6D,Anti-Finger Tempered Glass Hard Protective Shield Film Cover Adjustable Wrist Strap Shoulder Strap Adapter Include for Canon Eos 6D Digital SLR Camera",,
3182,B0073HSH8U,Nikon COOLPIX P510 16.1 MP CMOS Digital Camera with 42x Zoom NIKKOR ED Glass Lens and GPS Record Location (Black) (OLD MODEL),,
