,ASIN,title,price,rating,review_count
1352,B08HL64JS8,Samsung Electronics Galaxy Note 20 Ultra 5G Factory Unlocked Android Cell Phone | US Version | 128GB of Storage | Mystic Black (Renewed),869.9,4.0,15
1353,B089NXG7ZV,"Long-CZ J9 Latest 0.66"" Smallest Mini Flip Bluetooth Dialer Unlocked GSM Mobile Cell Phone with Voice Changer (Blue)",27.99,3.5,3
1354,B00812YWXU,Samsung Galaxy S3 16GB GSM Unlocked - (White),,4.4,3089
1355,B0102X3QX2,"Lumia 735, Black (Verizon Wireless)",,3.7,50
1356,B0061YRDX6,Samsung Galaxy Note N7000 16GB Unlocked Android Smartphone - Dark Blue,,3.8,266
1357,B07N8KRLF2,"Motorola Moto G7 Play 5.7"" Android 9.0 Pi UK Sim Free Smartphone 2GB RAM and 32GB Storage (Single Sim) - Indigo",,4.6,393
1358,B08PKJK6XP,"Unlocked Smartphones, Blackview A80 Android 10 Smartphone, 6.21 inch HD + Screen, Four Rear Cameras, 2GB + 16GB, 4200 mAh Battery, 8.8 mm Smooth & Slim Design, Dual SIM Unlocked Cell Phone GPS Black",109.99,4.0,4
1359,B086G9NF1P,"RCA Reno, 16GB, Android 10, 4G LTE Unlocked Smartphone (Black)",69.99,3.4,35
1360,B0888P92NC,"Xiaomi Redmi Note 9 Pro 64GB + 6GB RAM, 6.67"" FHD+ DotDisplay, 64MP AI Quad Camera, Qualcomm Snapdragon 720G LTE Factory Unlocked Smartphone - International Version (Tropical Green)",239.5,4.6,1093
1361,B07V5Q64J7,Google - Pixel 3a with 64GB Memory Cell Phone (Unlocked) - Clearly White (Renewed),173.97,4.1,326
1362,B017IOHGTI,"Orginal Oneplus X 4G Smartphone Android 5.1 3GB RAM+16GB ROM with 5.0"" Dual Sim International Version (black)",,3.8,50
1363,B08B3L2KCK,"Xiaomi Redmi 9 Unlocked RAM Dual Sim 32GB 3GB RAM 6.53"" International Global Version (Carbon Grey)",135.99,4.6,363
1364,B006PGXXOS,ZTE Warp Android Smartphone (Boost Mobile),,3.7,209
1365,B005C55X28,LG Vortex VS660 Android Smartphone Black No Contract - Verizon,,3.7,67
1366,B00H13CLR4,"Unlocked! 7.0"" 4G LTE GSM Unlocked Android Pie Smart Phone Tablet PC DualSIM (2GB RAM / 16GB ROM + QuadCore)",119.98,,0
1367,B08KSFC9J2,"LG K22 4G LTE Unlocked GSM (At&T/Tmobile/Cricket/Mint) Latin 32GB 2GB Ram 6.2"" Android 10 (Titan)",119.99,,0
1368,B00IZ1XVAC,"Samsung Galaxy S5, Black 16GB (Verizon Wireless)",,4.1,5424
1369,B00ISGNBTA,"LG A380, Black (AT&T)",,3.8,135
1370,B07SMBGBQS,"Oppo K3 8G+128G Mobile Phone 4G LTE Android 9 Snapdragon 710 Octa Core 6.5"" AMOLED VOOC 3.0 Screen Fingerprint Support Google-by (CTM Global Store) (Purple 8G+128G)",,5.0,2
1371,B07RL859ZT,"Google Pixel 3A (64GB, 4GB RAM) 5.6"" Display - GSM/CDMA Factory Unlocked (AT&T/T-Mobile/Verizon/Sprint) Global 4G LTE International Model (Just Black)",,4.7,310
1372,B07Y5V6LMT,Net10 LG Journey 4G LTE Prepaid Smartphone (Locked) - Black - 16GB - Sim Card Included - CDMA,39.99,4.4,71
1373,B08CL5326M,Net10 Motorola Moto E6 4G LTE Prepaid Smartphone (Locked) - Black - 16GB - Sim Card Included - CDMA,34.0,4.4,113
1374,B07Y5R4PWV,Net10 Samsung Galaxy A10e 4G LTE Prepaid Smartphone (Locked) - Black - 32GB - SIM Card Included - CDMA,72.0,4.4,268
1375,B07Y5T9X4P,TracFone LG Journey 4G LTE Prepaid Smartphone (Locked) - Black - 16GB - SIM Card Included - CDMA,29.88,4.3,406
1376,B00ISGNBTA,"LG A380, Black (AT&T)",,3.8,135
1377,B07SMBGBQS,"Oppo K3 8G+128G Mobile Phone 4G LTE Android 9 Snapdragon 710 Octa Core 6.5"" AMOLED VOOC 3.0 Screen Fingerprint Support Google-by (CTM Global Store) (Purple 8G+128G)",,5.0,2
1378,B07RL859ZT,"Google Pixel 3A (64GB, 4GB RAM) 5.6"" Display - GSM/CDMA Factory Unlocked (AT&T/T-Mobile/Verizon/Sprint) Global 4G LTE International Model (Just Black)",,4.7,310
1379,B088C3GQN7,"Samsung Galaxy A31 (128GB, 4GB) 6.4"" FHD+, Quad Camera, 5000mAh Battery, Dual SIM GSM Unlocked US + Global 4G LTE International Model - A315G/DSL (Prism Crush Black, 128GB + 128GB SD + Case Bundle)",246.0,4.4,155
1380,B07LCVDY78,T-MOBILE REVVL 2 32GB BLK Phone (Black),124.99,3.7,25
1381,B0775FLHPN,"Apple iPhone 8 Plus, 64GB, Space Gray - For AT&T / T-Mobile (Renewed)",338.98,4.5,1791
1382,B076QTDRN8,Samsung Galaxy Note 5 Verizon Wireless CDMA No-Contract 4G LTE Smartphone with Stylus Pen - Gold Platinum,,3.7,4
1383,B07C58S2JG,Kyocera DuraForce Pro E6820 Military Grade Rugged Smartphone for AT&T (Renewed),129.99,3.5,40
1384,B08PYDSP48,"Dilwe1 P40 Pro 7.2 Inch Smartphone, 1 + 16GB Waterdrop Screen Smartphone, Face Unlock, Dual Cards, Dual Standby Smartphone, 2MP + 5MP Dual Camera(Azul)",127.79,3.0,1
1385,B0766GHWM6,Google Pixel 2 Unlocked 64gb (Black),,4.1,233
1386,B06Y662YC3,CAT Phones CS60SUBUSAUN S60 Rugged Waterproof Smartphone with Integrated FLIR Camera,,3.9,27
1387,B08GL37KXS,OnePlus 7T Pro 5G McLaren Edition US Model HD1925 12GB RAM 256GB ROM T-Mobile Unlocked Single SIM,,4.3,63
1388,B08PKJK6XP,"Unlocked Smartphones, Blackview A80 Android 10 Smartphone, 6.21 inch HD + Screen, Four Rear Cameras, 2GB + 16GB, 4200 mAh Battery, 8.8 mm Smooth & Slim Design, Dual SIM Unlocked Cell Phone GPS Black",109.99,4.0,4
1389,B086G9NF1P,"RCA Reno, 16GB, Android 10, 4G LTE Unlocked Smartphone (Black)",69.99,3.4,35
1390,B01M25FRKG,"Unlocked LG Phoenix 2, 16GB, 4G LTE, 5"" HD Screen, 8MP/5MP, Android 6.0",64.99,4.0,154
1391,B07WGJ3NTF,LG G8 ThinQ LMG820TM 128GB T-Mobile Unlocked Phone - Carmine Red,309.99,4.5,174
1392,B07GWWXT9N,Samsung Galaxy S7 G930A 32GB AT&T Unlocked 4G LTE Quad-Core Phone w/ 12MP Camera - Black Onyx,,4.0,92
1393,B08LDDC2T4,"Cuifati Smartphone,6.8in face Unlock 5-Point Touching Screen 1440x3040 Cellphone,Dual Card Dual Standby,8+128G,for Android 10.0(US)",133.39,,0
1394,B01MR9QOO2,Samsung Galaxy S6 G920V 32GB Unlocked Verizon 4G LTE Smartphone W/ 16MP Camera - Sapphire Black,,3.9,96
1395,B076DJWGKF,"6.01"" Original Vivo X20 Mobile Phone Android 7.1 Snapdragon 660 Octa Core Full Screen 12MP Dual Camera 4+64G HiFi Face Wake (Black)",,,0
1396,B01ISZX0IW,"Indigi 4G LTE Smart Cell Phone 7-inch Android 9.0 Pie Tablet PC, QuadCore CPU + 2GB RAM/16GB ROM Phablet ATT Tmobile Straightalk Unlocked!",119.98,1.3,4
1397,B06XS2GWFC,Samsung Galaxy J7 - Verizon Carrier Locked No Contract Prepaid Smartphone,,4.2,160
1398,B01M1HXWL9,Sony Xperia XZ - Unlocked Smartphone - 32GB - Forest Blue (US Warranty),,4.0,415
1399,B017GTRFKA,Net10 Huawei Pronto Android GSM 4G LTE Smartphone,132.0,3.2,5
1400,B07THLXS7N,ZTE 6400C Unlocked GSM Phone 6 Inch Screen Octa-Core 1.4GHZ 2GB RAM,,3.9,110
1401,B088PKHG4K,HONOR 20e Dual-SIM 64GB ROM + 4GB RAM (GSM Only | No CDMA) Factory Unlocked 5G Android Smartphone (Black) - Internatioanl Version,,,0
1402,B07Y5V6LMT,Net10 LG Journey 4G LTE Prepaid Smartphone (Locked) - Black - 16GB - Sim Card Included - CDMA,39.99,4.4,71
1403,B08CL5326M,Net10 Motorola Moto E6 4G LTE Prepaid Smartphone (Locked) - Black - 16GB - Sim Card Included - CDMA,34.0,4.4,113
1404,B08BCDWLGC,"Ulefone Note 9P 4G Unlocked Cell Phones, 6.52"" HD+ Waterdrop Screen,16MP Triple Rear Camera, Android 10 Octa-Core 4GB + 64GB,4500mAh Big Battery, Face Unlock Finger Reader Unlocked Smartphones - Black",159.99,4.1,1166
1405,B07Y5R4PWV,Net10 Samsung Galaxy A10e 4G LTE Prepaid Smartphone (Locked) - Black - 32GB - SIM Card Included - CDMA,72.0,4.4,268
1406,B01M33F1YQ,"Cricket KYOCERA Hydro View 5"" QHD Display 4G LTE Water Proof and Dust Proof (3ft/30min) (Locked to Cricket)",,3.2,199
1407,B07TWXJLQF,"Huawei Mate 20 X (5G) Dual-SIM 256GB + 8GB RAM (GSM Only, No CDMA) Factory Unlocked Android Smartphone (Emerald Green) - International Version",,4.3,84
1408,B083589DF5,"LG G7 Fit 32GB 6.1"" Smartphone - GSM+CDMA Factory Unlocked for All Carriers - Aurora Black (US Warranty) by LG",,4.1,413
1409,B07FZ6CRRT,LG Stylo 4 - 32GB - Prepaid Cell Phone - Carrier Locked - (Boost Mobile),,4.0,220
1410,B002YDZSQM,BlackBerry Bold 9700 Unlocked GSM 3G World Phone w/ Full Keyboard - Black,,4.0,328
1411,B08S99BCMV,Samsung Galaxy Z Flip 5G Factory Unlocked New Android Cell Phone | US Version Smartphone | 256GB Storage | Mystic Gray with Wireless Charger Convertible Qi Certified (Pad/Stand) - Black (US Version),,,0
1412,B071WVZLGP,"AGM A8 Rugged Android Phone - Android 7.0, Dual IMEI, 4G, Quad-Core CPU, 3GB RAM, 5 Inch IPS Display, 13MP Cam, OTG, NFC",,3.9,7
1413,B00ZE8HRYK,"Samsung Galaxy S6 Active, 32 GB , Grey (AT&T)",,4.1,268
1414,B08KYTL2W9,Samsung Galaxy S20 Ultra 5G Factory Unlocked New Android Cell Phone US Version | 128GB of Storage | Long-Lasting Battery | Cosmic Black with Verizon SIM Kit for eGift Card,,,0
1415,B08KYS87P6,Samsung Galaxy S20 Ultra 5G Factory Unlocked New Android Cell Phone US Version | 128GB of Storage | Long-Lasting Battery | Cosmic Gray with Verizon SIM Kit for eGift Card,,,0
1416,B00J1SMJ06,"LG Xpression 2, Blue (AT&T)",,4.0,316
1417,B089KX2DXS,Alcatel 1B (2020) 4G LTE GSM Unlocked 5.5 inch 8MP Flash 16GB 5002A Quad Core Factory Unlocked Android 10 Go Worldwide - NO CDMA - Desbloqueado,,4.3,4
1418,B08PKJK6XP,"Unlocked Smartphones, Blackview A80 Android 10 Smartphone, 6.21 inch HD + Screen, Four Rear Cameras, 2GB + 16GB, 4200 mAh Battery, 8.8 mm Smooth & Slim Design, Dual SIM Unlocked Cell Phone GPS Black",109.99,4.0,4
1419,B08CL5326M,Net10 Motorola Moto E6 4G LTE Prepaid Smartphone (Locked) - Black - 16GB - Sim Card Included - CDMA,34.0,4.4,113
1420,B08LTFP6CX,"Samsung Galaxy Z Fold 2 5G | Factory Unlocked Android Cell Phone | 256GB Storage | Mystic Bronze with Samsung Galaxy Buds Live, True Wireless Earbuds",,,0
1421,B08JH5V9LY,OPPO A73 5G Dual-SIM 128GB (GSM Only | No CDMA) Factory Unlocked Android Smartphone (Navy Black) - International Version,495.0,4.3,25
1422,B00YOM5M0I,HTC One M9 32GB Android Smartphone w/ Front-Facing Speakers and 20MP Camera Unlocked for all GSM Carriers Worldwide - Gunmetal Gray,,4.0,5
1423,B00SM2YQ6C,FreedomPop Tab Liberty Unlocked Cell Phones - Non-Retail Packaging - Black,33.66,,0
1424,B08HH2LBHF,"Samsung Galaxy S20 Ultra, 128GB, Cosmic Black - Fully Unlocked (Renewed)",,4.3,269
1425,B0045JHKVY,HTC Aria Black WiFi Android GSM QuadBand 3G At&t Cell Phone,,3.0,113
1426,B07NSPMFYS,"BlackBerry KEY2 Red Unlocked Android Smartphone (AT&T/T-Mobile) 4G LTE, 128GB",,3.8,12
1427,B006QO8QUA,Verizon LG Accolade VX5600 Camera GPS Cell Phone - New - No Contract Req'd,,3.9,231
1428,B08B8JSG95,"Samsung Galaxy A51 LTE Verizon | 6.5"" AMOLED Screen | 128GB of Storage | Long Lasting Battery | Single SIM | 2020 Model | US Version & Warranty| Black - (SM-A515UZKNVZW)",,,0
1429,B0887WBNN4,"Moto G8 Power Lite (64GB,4GB) 6.5"", 5000 mAh Battery, Dual SIM GSM Unlocked, Global 4G LTE International Model (T-Mobile, AT&T, Metro, Cricket) XT2055-2 (64GB SD + Case Bundle, Navy Blue)",169.99,4.2,379
1430,B07S8CZQW5,"Samsung Galaxy A20s (32GB 2GB RAM) 6.5"" HD+ Triple Camera SM-A207F/DS 4G LTE (AT&T Europe Asia Africa Cuba Digitel) Dual SIM GSM Factory Unlocked - International Version - No Warranty (Blue)",190.98,4.3,163
1431,B08NPYBG7R,"SOYES S10P Mini Card Phone Unlocked 2G GSM Quad Band Mini Mobile Phones 400mAh 1.54""IPS Color MTK6261M Cellphone Ultra-Thin Fashion Small Size Kids Cell Phones (Blue)",25.99,,0
1432,B07Y5V6LMT,Net10 LG Journey 4G LTE Prepaid Smartphone (Locked) - Black - 16GB - Sim Card Included - CDMA,39.99,4.4,71
1433,B088NFQDSH,Total Wireless Samsung Galaxy A01 4G LTE Prepaid Smartphone - Black - 16GB - Sim Card Included -CDMA,51.72,4.4,628
1434,B088NFQDSH,Total Wireless Samsung Galaxy A01 4G LTE Prepaid Smartphone - Black - 16GB - Sim Card Included -CDMA,51.72,4.4,628
1435,B089NDJLVZ,"MoKo 10"" Selfie Ring Light with Tripod Stand Phone Holder for Live Stream/Makeup/Vlogging, Desktop Led Dimmable Camera Ringlight for TikTok/YouTube Video/Photography Compatible with iPhone Android",17.99,5.0,1
1436,B078T3D547,"Huawei Mate 10 Pro Unlocked Phone, 6"" 6GB/128GB, AI Processor, Dual Leica Camera, Water Resistant IP67, GSM Only - Titanium Gray (US Warranty)",,4.4,834
1437,B08S92H611,Samsung Galaxy Z Flip 5G Factory Unlocked New Android Cell Phone | 256GB Storage | Mystic Bronze with Wireless Charger Convertible Qi Certified (Pad/Stand) - Black,,,0
1438,B01LXCZCQA,LG Tribute HD - Prepaid - Carrier Locked - Virgin Mobile,,3.7,286
1439,B07ZHWNKQS,"Samsung Galaxy Note 10 Factory Unlocked Phone with 256GB (U.S. Warranty), Aura Silver with Tab S5e 10.5 Black 64GB Unlocked",,,0
1440,B077MR13HM,Samsung Galaxy S7 G930T 32GB T-Mobile Unlocked 4G LTE Quad-Core Phone w/ 12MP Camera - Gold,,4.1,139
1441,B08HK37ZY8,"DOOGEE S95 Super Rugged Smartphones Unlocked (2020) Helio P90 48MP Triple Rear Camera 6GB RAM+128GB ROM 8650mAh(Battery Module+Speaker Module) IP68 Waterproof Dropproof Dust Proof 6.3"" FHD+ NFC Phone",419.99,3.7,7
1442,B08G4Z44BV,4G Walkie Talkie LTE POC WiFi Android Smartphone SOS Military Rugged zello Phone PTT Interphone IP67 Waterproof Shockproof GPS Dual Camera 4600mAh Battery IP68 Quad core Cell Phones Unlocked Dual Sim,,,0
1443,B00V5LZUWQ,"Samsung Galaxy S6, Black Sapphire 32GB (AT&T)",,4.1,207
1444,B08D2KVJ27,Samsung Galaxy J7 2018 J737P Sprint Phone w/ 13 MP Camera - Gold (Renewed)…,107.0,3.7,21
1445,B07JZGL9PS,"LG Stylo 4, 32 GB - GSM Unlocked - Black",,4.2,278
1446,B076KBJF8W,GTStar Mini bluetooth handset phone UPGRADED BM50 0.66 inch Unlocked Mini Mobile Phone Bluetooth Earphone Dialer Dual SIM Card Slots(White),20.99,2.7,2
1447,B07GBX115M,Total Wireless Motorola Moto G6 4G LTE Prepaid Smartphone (Locked) - Black - 16GB - Sim Card Included - CDMA,86.27,4.2,113
1448,B08PKJK6XP,"Unlocked Smartphones, Blackview A80 Android 10 Smartphone, 6.21 inch HD + Screen, Four Rear Cameras, 2GB + 16GB, 4200 mAh Battery, 8.8 mm Smooth & Slim Design, Dual SIM Unlocked Cell Phone GPS Black",109.99,4.0,4
1449,B08CL5326M,Net10 Motorola Moto E6 4G LTE Prepaid Smartphone (Locked) - Black - 16GB - Sim Card Included - CDMA,34.0,4.4,113
1450,B08FDRHPCJ,"Mobile Phones Sim Free Unlocked Smartphone A91, 4G Android 10.0, 6.7 inch FHD Display with 4800mAh Battery, 4GB RAM 32GB ROM, 128GB Extension",,,0
1451,B0725NSTNH,Samsung Galaxy J7 V Verizon Wireless - Silver,,4.2,54
1452,B08J5BNFSY,Net10 Motorola Moto e 4G LTE Prepaid Smartphone (Locked) - Midnight Blue - 32GB - Sim Card Included - CDMA,59.99,,0
1453,B07ZKPJ5CB,AK009 Mini Phone 5 in 1 Unlocked GSM Pen Style Phone Cigarette Lighter Flashlight Voice Changer Bluetooth Dialer (Red),32.99,2.0,2
1454,B08BRG8X5G,XBOSS K-Touch 10 3G 2G+16G/3G+32G/3G+64G Smallest Dual Sim Card Ultra Thin Android 8.1 Full Screen Mini Smart Phone Unlocked (3GB+64GB Blue),200.0,3.2,3
1455,B01IG1OMSU,"Indigi GSM Unlocked 4G LTE Android 9.0 Pie 7-inch TabletPC & Smartphone [Quad-Core, 2GB RAM/16GB ROM + DUALSIM + ] 2GB RAM/16GB ROM (White)",119.99,,0
1456,B08Q6BYDRZ,BLU J7L J0070WW GSM Unlocked Phone - Black,85.4,,0
1457,B07FSD86KD,"Nokia 8110 (TA-1059) 512MB/4GB 2.45-inches Factory Unlocked, International Stock (Yellow)",69.99,3.9,97
1458,B07SH9JWBF,"LG V40 ThinQ 64GB GSM Unlocked (AT&T/T-Mobile) 5-Camera Smartphone w/ 6.4"" QHD+ Display - Aurora Black",334.0,4.1,162
1459,B01GGKMW4Y,"KOCASO Discover TV Cell Phone (Television Feature, Dual SIM, Analog TV Built In, Apps, MP3/MP4 Music Player, FM Radio, Flashlight, Unlocked) - Black",29.85,3.6,52
1460,B07GLZK3KK,BM10 Dual Sim Super Small Phone with Wireless Bluetooth Dialer Like BM70 Unlocked (Dark Blue),22.5,3.6,6
1461,B07JHXX5YR,ROG Phone Gaming Smartphone ZS600KL-S845-8G512G - 6” FHD+ 2160x1080 90Hz Display - Qualcomm Snapdragon 845 - 8GB RAM - 512GB Storage - LTE Unlocked Dual SIM Gaming Phone - US Warranty,,4.2,222
1462,B07Y5V6LMT,Net10 LG Journey 4G LTE Prepaid Smartphone (Locked) - Black - 16GB - Sim Card Included - CDMA,39.99,4.4,71
1463,B07Y5R4PWV,Net10 Samsung Galaxy A10e 4G LTE Prepaid Smartphone (Locked) - Black - 32GB - SIM Card Included - CDMA,72.0,4.4,268
1464,B08BCDWLGC,"Ulefone Note 9P 4G Unlocked Cell Phones, 6.52"" HD+ Waterdrop Screen,16MP Triple Rear Camera, Android 10 Octa-Core 4GB + 64GB,4500mAh Big Battery, Face Unlock Finger Reader Unlocked Smartphones - Black",159.99,4.1,1166
1465,B087LZNMYB,"TCL 10 Pro Unlocked Android Smartphone with 6.47"" AMOLED FHD + Display, 64MP Quad Rear Camera System, 128GB+6GB RAM, 4500mAh Fast Charging Battery",449.99,4.3,357
1466,B07HRSGSSJ,"Honor 8X 64GB Dual-SIM Android (GSM Only, No CDMA) Factory Unlocked 4G/LTE Smartphone - International Version (Black)",,4.1,38
1467,B08CHRHFRL,Samsung Galaxy A01 (Verizon) 16GB Black- SM-A015VZKAVZW (Renewed),88.88,4.5,20
1468,B08B8PPGR9,Samsung Galaxy A11 PRE-Paid LTE Verizon | 32GB of Storage | Long Lasting Battery | Single SIM | 2020 Model | US Version & Warranty| Black - SM-A115UZKPVZW,,,0
1469,B00GWR8YSA,"Samsung Galaxy S3 SCH-I535 Verizon Phone, 16GB, Marble White",,3.8,481
1470,B07X8CR5ZW,"Rugged Cellphones Unlocked Blackview BV9500 Plus,IP68/69K MIL-STD-810G Waterproof 4G LTE Smartphone,5.7"" 4GB/64GB Octa Core Android 9.0 Mobile,Dual Sim,10000mAh Battery Wireless Charging,NFC, (Yellow)",,4.5,2
1471,B08B99D7FJ,"Xiaomi Poco X3 NFC 64GB, 6GB RAM, 5160mAh (typ) Large Battery, 6.67"" DotDisplay, QUALCOMM Snapdragon GSM LTE Factory Unlocked Smartphone - International Version (Cobalt Blue)",227.0,4.6,585
1472,B075ZD2WFN,Samsung Galaxy S8+ G955U 64GB Unlocked GSM U.S. Version Smartphone w/ 12MP Camera - Orchid Gray,,4.3,58
1473,B07GC56GJG,Simple Mobile Samsung Galaxy J7 Crown 4G LTE Prepaid Smartphone (Locked) - Black - 16GB - Sim Card Included - GSM,151.99,4.3,25
1474,B01E17M834,TracFone Alcatel One Touch A462C Pixi Eclipse 3G Android Prepaid Smartphone - Retail Packaging,,3.9,5
1475,B005MUC9DY,Straight Talk Samsung Galaxy Precedent Android Prepaid Cell Phone (USES SPRINT TOWERS),,3.7,107
1476,B07W6L53SN,LG Stylo 5 with Alexa Push-to-Talk – Unlocked – 32 GB – Silvery White (US Warranty),,4.5,749
1477,B07JLQ7JB8,"TracFone - Alcatel Raven LTE - A574B Android 7.1 16GB 5MP 5""",,5.0,2
1478,B08PKJK6XP,"Unlocked Smartphones, Blackview A80 Android 10 Smartphone, 6.21 inch HD + Screen, Four Rear Cameras, 2GB + 16GB, 4200 mAh Battery, 8.8 mm Smooth & Slim Design, Dual SIM Unlocked Cell Phone GPS Black",109.99,4.0,4
1479,B08CL5326M,Net10 Motorola Moto E6 4G LTE Prepaid Smartphone (Locked) - Black - 16GB - Sim Card Included - CDMA,34.0,4.4,113
1480,B07WZJMJD8,"Unlocked Cell Phone, OUKITEL C17 Pro 64GB+4GB Unlocked Phones 13+5MP Triple-Lens Camera Unlocked Smartphone 6.35 inch Blind Hole Display Mobile Phone MT6763 CPU-Twilight",139.9,3.8,42
1481,B01EB65JMW,"ZTE AVID PLUS Z828, (8GB, 1GB RAM), 5.0"" Full HD Display, 5MP Rear Camera, 2300 mAh Battery, 4G LTE Smartphone, (T-Mobile)",,3.9,97
1482,B08B2YVZ62,"Original X50(V I V O) 5G Mobile 8G+128GB Snapdragon765G 6.56"" AOMLED 2376x1080P 48MP 4200mAh NFC 33W Charge Fingerprint Android10 Smartphone Support Google by-（Real Star Technology） (Blue 8+128)",499.99,,0
1483,B08B8Y5R4Y,"Samsung Galaxy S20 5G, 128GB, Cosmic Gray - Fully Unlocked (Renewed)",574.0,4.4,569
1484,B079RBDBKJ,Kyocera Duraforce Pro E6820 32GB Phone w/ 13MP Camera - Black (Renewed),99.99,2.8,24
1485,B00P8FV0FG,BLU Dash JR W D141w Unlocked GSM Dual-SIM Android Cell Phone - White,,3.7,217
1486,B07HKQJ6H1,Google Pixel Phone 3-64GB Clearly White (Renewed),226.0,4.1,161
1487,B00TTCZN02,Indigi V13BK-CP01 Unlocked 5.5-Inch DualSim 3G Smart Phone DualCore Android 4.4,119.69,3.0,13
1488,B071VTYHDQ,Verizon Motorola Moto E4 Prepaid Phone - Carrier Locked to Verizon Prepaid,79.95,4.4,238
1489,B07QD67Z1Y,Samsung Galaxy A50 A505F 128GB Dual SIM Unlocked GSM Phone w/ Triple (25MP+8MP+5MP) Camera - Black,309.99,3.9,914
1490,B07K817ZVD,BLU Studio Mega 2018-6.0” HD Unlocked Smartphone with Dual Main Camera -Blue,,3.6,244
1491,B01CP4CGTQ,"Samsung Galaxy S7 G930P 32GB, Black Onyx - Sprint",,4.1,235
1492,B07Y5V6LMT,Net10 LG Journey 4G LTE Prepaid Smartphone (Locked) - Black - 16GB - Sim Card Included - CDMA,39.99,4.4,71
1493,B07Y5R4PWV,Net10 Samsung Galaxy A10e 4G LTE Prepaid Smartphone (Locked) - Black - 32GB - SIM Card Included - CDMA,72.0,4.4,268
1494,B088NFQDSH,Total Wireless Samsung Galaxy A01 4G LTE Prepaid Smartphone - Black - 16GB - Sim Card Included -CDMA,51.72,4.4,628
1495,B089NDJLVZ,"MoKo 10"" Selfie Ring Light with Tripod Stand Phone Holder for Live Stream/Makeup/Vlogging, Desktop Led Dimmable Camera Ringlight for TikTok/YouTube Video/Photography Compatible with iPhone Android",17.99,5.0,1
1496,B08MT2NTCR,L8STAR BM30 Mini Phone Single SIM TF Card 0.66 inch Unlocked GSM Cellphone Wireless Headphone Bluetooth Dialer Headset Mobile Handset with Voice Changer Mp3 (Blue),20.99,,0
1497,B01N2U0SXP,"HTC 10 32GB, Glacier Silver (Verizon)",,3.6,118
1498,B06XNSV8D8,BlackBerry PRIV (32GB) Verizon Factory Unlocked Phone (GSM + CDMA) - U.S. Version STV100-2 (Black),319.99,3.8,118
1499,B07DFMJ6NF,Samsung Galaxy S9 Factory Unlocked Smartphone (US Version) 128GB  - Midnight Black - [SM-G960UZKEXAA],,4.5,106
1500,B08MW3872V,"Smartphones Tzp- Note21U Unlocked Cell Phones(6GB+128GB) 6.6"" HD+ Full Screen, 5000mAh High Capacity Battery, Android 10, Dual SIM, Face ID",,,0
1501,B082ZSV2MS,Original X30 Pro(V I V O) 5G Mobile 8G+128GB 60x Zoom 6.44 inch HDR Exynos 980 Octa-core Android 9.0 64.0MP Quad Cameras 4350mAh Smartphone Support Google by-（Real Star Technology） (Silver 8G+128GB),,,0
1502,B08JS1P82B,Samsung Electronics Galaxy Note 20 Ultra 5G Factory Unlocked Android Cell Phone | US Version | 128GB of Storage | Mystic White with Verizon SIM Kit for eGift Card,,5.0,1
1503,B08JRZHM1P,Samsung Galaxy Note20 5G Factory Unlocked Android Cell Phone | US Version | 128GB of Storage | Mystic Green with Verizon SIM Kit for eGift Card,,5.0,1
1504,B08LXLC8B4,Samsung Galaxy A21 32GB 6.5 inches Quad Camera A215 Unlocked Black Single SIM (Renewed),190.99,3.8,8
1505,B08B3D2C1T,"HONOR 9X 6.59 inch Smartphone, 4GB 128GB, 48 MP AI Dual Camera, 16MP Pop-up Front Selfie Camera, Dual SIM GSM Unlocked 4G LTE International Version EU Plug US Adapter, Blue",229.99,4.5,410
1506,B08L941YML,"Smartphone,6.7IN 1440X3040 Fingerprint Unlock Dual Cards Dual Standby Smartphone,Face Unlock,5 Point Touching Screen Smartphone,100‑240V 8+256GB(US)",138.99,3.1,3
1507,B01EWKHIAI,Microsoft Lumia 950 32GB Dual Sim NAM RM-1118 GSM Factory Unlocked - US Warranty (Black),,3.7,95
1508,B08PKJK6XP,"Unlocked Smartphones, Blackview A80 Android 10 Smartphone, 6.21 inch HD + Screen, Four Rear Cameras, 2GB + 16GB, 4200 mAh Battery, 8.8 mm Smooth & Slim Design, Dual SIM Unlocked Cell Phone GPS Black",109.99,4.0,4
1509,B08CL5326M,Net10 Motorola Moto E6 4G LTE Prepaid Smartphone (Locked) - Black - 16GB - Sim Card Included - CDMA,34.0,4.4,113
1510,B07GVRC54W,"Apple iPhone X, 64GB, Space Gray - For GSM (Renewed)",294.99,4.3,7196
1511,B07ZGGH33V,"BLU Vivo X5-5.7"" HD Display Smartphone, 64GB+3GB RAM-International Unlocked -Black",,4.0,188
1512,B07MKY35D4,"Honor View 20 Dual-SIM (128GB ROM/6GB RAM, GSM Only, No CDMA) Factory Unlocked 4G/LTE Smartphone - International Version (Sapphire Blue)",,4.6,190
1513,B07ZJV87L5,ZTE Blade V9 Vita 4G LTE Unlocked GSM Dual Camera 13MP Octa Core 16GB / 2GB RAM (LTE USA Latin Caribbean) Android 8.1,,3.8,35
1514,B084J4VKD5,Samsung Galaxy S20+ Plus (5G) 128GB SM-G986B/DS Dual SIM (GSM Only | No CDMA) Factory Unlocked Smartphone - International Version - Cosmic Black,,4.3,51
1515,B085TJLKK3,"Unlocked Cell Phone, Full Voice-Assistance Touch Screen Flip Mobile Phone for The Elderly 100-240V(US)",45.69,3.9,4
1516,B00OYZZ3VS,"BlackBerry Classic Factory Unlocked Cellphone, Black",,3.9,739
1517,B08SNWG45W,"Moto G9 Power (128GB, 4GB) 6.8"" HD+, Snapdragon 662, 6000mAh Battery, Dual SIM GSM Global Unlocked 4G LTE (T-Mobile, AT&T, Metro) International Model XT2091-4 (64GB SD Bundle) (Jazz Blue)",255.0,5.0,1
1518,B08JMHG62F,"Google Pixel 5 128GB + 8GB RAM - 6 inch Android 5G Phone, Water Resistant (IPX8) - GSM Unlocked Smartphone (Just Black) - UK Version",979.0,4.7,15
1519,B084DPW5TF,Samsung Galaxy S20+ 5G 128GB SM-G986B/DS Dual SIM (GSM Only | No CDMA) Factory Unlocked Smartphone - International Version - Cosmic Black,784.5,4.7,185
1520,B07ZTN5F21,Motorola One Action XT2013 128GB Unlocked GSM Dual SIM Phone w/ 12MP Camera - Denim Blue,,4.3,10
1521,B07W99MX2G,"LG K40 Factory Unlocked Phone - 5.7"" Screen - Platinum (U.S. Warranty)",199.99,3.9,268
1522,B07Y5V6LMT,Net10 LG Journey 4G LTE Prepaid Smartphone (Locked) - Black - 16GB - Sim Card Included - CDMA,39.99,4.4,71
1523,B07Y5R4PWV,Net10 Samsung Galaxy A10e 4G LTE Prepaid Smartphone (Locked) - Black - 32GB - SIM Card Included - CDMA,72.0,4.4,268
1524,B088NFQDSH,Total Wireless Samsung Galaxy A01 4G LTE Prepaid Smartphone - Black - 16GB - Sim Card Included -CDMA,51.72,4.4,628
1525,B08BCDWLGC,"Ulefone Note 9P 4G Unlocked Cell Phones, 6.52"" HD+ Waterdrop Screen,16MP Triple Rear Camera, Android 10 Octa-Core 4GB + 64GB,4500mAh Big Battery, Face Unlock Finger Reader Unlocked Smartphones - Black",159.99,4.1,1166
1526,B084HN8V35,Google Pixel 4 64gb Clearly White Verizon Locked (Renewed),258.95,4.1,19
1527,B01N6YB3EB,Alcatel A30 GSM (AT&T/T-Mobile) - 16 GB - Black – Unlocked - Prime Exclusive - with Lockscreen Offers & Ads,,3.8,397
1528,B077ZKFB2D,"Sony Xperia XA2 Factory Unlocked Phone - 5.2"" Screen - 32GB - Black (U.S. Warranty)",,4.1,441
1529,B07GC5QK99,TracFone LG Stylo 4 4G LTE Prepaid Smartphone with Amazon Exclusive $40 Airtime Bundle,125.68,4.3,83
1530,B07KKP8G1Q,"Samsung Galaxy A9 2018 SM-A920F Dual SIM - Unlocked - 4G LTE - 6.3"" Screen - 6GB/128GB Memory - Quad Camera - 24MP Selfie Camera - Black",299.99,4.3,80
1531,B082T6CKGD,Samsung Galaxy A51 A515F 128GB DUOS GSM Unlocked Phone w/ Quad Camera 48 MP + 12 MP + 5 MP + 5 MP (International Variant/US Compatible LTE) - Prism Crush White,,4.1,19
1532,B01LY5VWJK,ZTE Axon 7 Mini - 32gb - Factory Unlocked Phone - (Platinum Grey),,3.8,526
1533,B08HJLH3F7,OnePlus 8T 5G Dual-SIM 256GB ROM + 12GB RAM Factory Unlocked Android Smartphone (Aquamarine Green) - International Version,,4.7,171
1534,B08VNGHMGL,HTC U20 5G 2Q9F100 256GB 8GB RAM International Version - Green,,,0
1535,B06Y6J869C,LG (LGLS777ABB) Stylo 3 - Prepaid - Carrier Locked - Boost Mobile,,4.2,668
1536,B08J5JLKTT,Net10 LG K31 Rebel 4G LTE Prepaid Smartphone (Locked) - Black - 32GB - Sim Card Included - CDMA,39.99,,0
